"sourceRereadId","sourceId","researchQuestion","primarySourceLocator","verifiedFinding","correction","newSourceAdded","publicationIntegrityStatus","reviewedAt"
"C31_READ_35142563","SRC_PMID_35142563","Weighted heel-rise load representation","Journal of Applied Physiology full text, methods and results","A weighted vest attached to the torso added mass equal to 20 percent of bodyweight; the reported 1.2 BW denotes total system mass, not added external mass.","Store added fraction 0.20 and total-system fraction 1.20 separately.","false","NO_ADVERSE_NOTICE_FOUND","2026-07-15T00:00:02Z"
"C31_READ_21092960","SRC_PMID_21092960","ACL strain timing and mechanism","Primary full text and PubMed record","Peak ACL strain was 12 plus or minus 7 percent and occurred 55 plus or minus 14 ms before ground impact at maximal extension.","Represent TENSION x PEAK strain with JUMP_LANDING and PRE_CONTACT context; no directional mechanism.","false","NO_ADVERSE_NOTICE_FOUND","2026-07-15T00:00:02Z"
"C31_READ_31593498","SRC_PMID_31593498","ACL strain timing and mechanism","Primary abstract and source methods/results","Peak ACL strain occurred 55 plus or minus 35 ms before initial contact during a single-legged jump; no exact directional cause was measured.","Represent TENSION x PEAK strain with JUMP_LANDING and PRE_CONTACT context; retain missing magnitude.","false","NO_ADVERSE_NOTICE_FOUND","2026-07-15T00:00:02Z"
"C31_READ_32658037","PREFLIGHT_32658037","Achilles point-anchor boundaries","Primary source exercise table","Standing single-leg heel rise 3.0 BW and repeated unilateral hop 7.3 BW are distinct tested conditions.","Treat both as condition anchors; no interval or HIGH band.","false","NO_ADVERSE_NOTICE_FOUND","2026-07-15T00:00:02Z"
"C31_READ_25059338","SRC_PMID_25059338","Passive inversion transfer","Primary abstract and methods","Device-applied passive inversion force is boundary evidence, not landing or exercise exposure.","Retain source context and prohibit app transfer.","false","NO_ADVERSE_NOTICE_FOUND","2026-07-15T00:00:02Z"
"C31_READ_30923576","SRC_PMID_30923576","Kinematic proxy validation","Primary abstract and methods","In-vitro kinematic stability is not a validated internal ligament-force mapping.","Classify as UNVALIDATED_PROXY and block rubric/profile use.","false","NO_ADVERSE_NOTICE_FOUND","2026-07-15T00:00:02Z"
