"박스 점프","ex_d9e141e4","category=기능성운동; movement_category=PLYOMETRIC; force_type=PLYOMETRIC; movement_pattern=PLYOMETRIC_SSC|LOWER_BODY_POWER|LANDING_CONTROL_SUPPORT","PLYOMETRIC_SSC|LOWER_BODY_POWER|LANDING_CONTROL_SUPPORT","PLYOMETRIC","PLYOMETRIC","EXERCISE","NOT_PRESENT_IN_SEED","PLYOMETRIC_JUMP_VARIANTS","NEEDS_SUBTYPE_REVIEW","GLUTE_MAX|QUADRICEPS|GASTROCNEMIUS|SOLEUS|HAMSTRINGS|RECTUS_FEMORIS|TIBIALIS_ANTERIOR|GLUTE_MED_MIN|HIP_ADDUCTORS|DEEP_CORE|OBLIQUES","{""GLUTE_MAX"":0.18,""QUADRICEPS"":0.22,""RECTUS_FEMORIS"":0.08,""GASTROCNEMIUS"":0.14,""SOLEUS"":0.1,""HAMSTRINGS"":0.08,""GLUTE_MED_MIN"":0.07,""HIP_ADDUCTORS"":0.05,""TIBIALIS_ANTERIOR"":0.04,""DEEP_CORE"":0.04}","PLYOMETRIC_POWER","VERTICAL_JUMP_SSC","QUALITY_BASED","ELASTIC_SSC|NEURAL_SPEED|DECELERATION_REVIEW","JUMP_LANDING_REVIEW","LOWER_POWER|LANDING_SUPPORT","FATIGUE|BADMINTON_TRANSFER|BALANCE","B_NSCA_ESSENTIALS_5E|E_BADMINTON_TRAINING_EFFECTS_PMC12239426|E_BADMINTON_RESISTANCE_CORE_PMC12176550","governing_body_resource","LOW","NO","NO","NO","NO","NO","NO","NO","PARTIAL","NO","NEEDS_STRESS_REVIEW","Axial, plyometric, deceleration, SSC, or session stress mapping needs review.","REVIEW_STRESS_AND_RECOVERY_MAPPING","Draft only; do not mutate seed without human approval. Muscle contribution is an app-internal heuristic, not a physiological measurement. Subtype intentionally left for review; no broad exercise-name parsing was used. Sources need network recheck: E_BADMINTON_TRAINING_EFFECTS_PMC12239426","NO","ANATOMY_SUPPORTED_TEMPLATE","Approved compressed stress profile PLYOMETRIC_LANDING_STRESS was applied with separate detail tags. Source verification remains separate and unresolved.","NONE","SOURCE_ONLY","ACCEPT_SOURCE_POLICY_DRAFT_ONLY","READY_AFTER_SOURCE_VERIFICATION","STRESS_REVIEW_REQUIRED","","PLYOMETRIC_JUMP_VARIANTS","NEEDS_SUBTYPE_REVIEW","PLYOMETRIC_POWER","VERTICAL_JUMP_SSC","QUALITY_BASED","","FATIGUE|BADMINTON_TRANSFER|BALANCE","PLYOMETRIC_LANDING_STRESS","QUAD_LOAD/GLUTE_LOAD/CALF_ANKLE_SSC_LOAD/LANDING_LOAD/DECELERATION_LOAD","ACHILLES_TENDON_STRESS/PATELLAR_TENDON_STRESS","ANKLE_INVERSION_LIGAMENT_STRESS/KNEE_VALGUS_CONTROL_STRESS/KNEE_ROTATIONAL_STABILITY_STRESS","HIGH_AMPLITUDE_JUMP_LANDING_STRESS","NONE","NONE","LONG","HIGH","","","","","","STRESS","SOURCE_ACCEPTED_DRAFT_ONLY","Approved compressed stress profile PLYOMETRIC_LANDING_STRESS was applied with separate detail tags.","VERIFIED_FAMILY","ACCEPT_VERIFIED_FAMILY","The existing source group supports the movement or sport family at family level.","Acceptance does not claim that every equipment or stance variant was studied directly.","NO","NONE","SOURCE_ACCEPTED","SOURCE_VERIFICATION_ONLY"
"발목/고관절 가동성","ex_149730de","category=기능성운동; movement_category=MOBILITY; force_type=MOBILITY; movement_pattern=MOBILITY|RECOVERY_SUPPORT|ANKLE_HIP_MOBILITY","MOBILITY|RECOVERY_SUPPORT|ANKLE_HIP_MOBILITY","MOBILITY","MOBILITY","EXERCISE","NOT_PRESENT_IN_SEED","MOBILITY_WARMUP_RECOVERY_EXERCISES","NEEDS_SUBTYPE_REVIEW","","NONE","WARMUP_RECOVERY","RECOVERY_LOW_LOAD","QUALITY_BASED","LOW_FATIGUE_REHAB|MINIMAL_RECOVERY_DECAY","NONE","SHOULDER_DURABILITY|HIP_MOBILITY|ANKLE_MOBILITY_REVIEW","RECOVERY_ONLY|BALANCE","A_OPENSTAX_10_2|D_SCAP_ROTATOR_CUFF_PMC2857390|C_GLUTE_REHAB_EMG_PMC3201064","anatomy_textbook","NEEDS_REVIEW","NO","YES","NO","NO","NO","NO","NO","PARTIAL","NO","NEEDS_ROW_REVIEW","Row family or subtype requires explicit human judgement before mutation.","CONFIRM_FAMILY_AND_SUBTYPE","Draft only; do not mutate seed without human approval. Subtype intentionally left for review; no broad exercise-name parsing was used. Sources need network recheck: D_SCAP_ROTATOR_CUFF_PMC2857390|C_GLUTE_REHAB_EMG_PMC3201064","NO","ANATOMY_SUPPORTED_TEMPLATE","Approved reusable template MOBILITY_WARMUP_RECOVERY_EXERCISES was applied. Source verification remains separate and unresolved.","NONE","SOURCE_ONLY","ACCEPT_SOURCE_POLICY_DRAFT_ONLY","READY_AFTER_SOURCE_VERIFICATION","TEMPLATE_DEFINITION_REQUIRED","MOBILITY_WARMUP_RECOVERY_EXERCISES","MOBILITY_WARMUP_RECOVERY_EXERCISES","","MOBILITY_RECOVERY","MOBILITY_RECOVERY_PREP","TIME_OR_COMPLETION","MOBILITY_RECOVERY_PREP","RECOVERY_CONTEXT/MOBILITY","","","","","","","","","","","","","","","TEMPLATE","SOURCE_ACCEPTED_DRAFT_ONLY","Approved reusable template MOBILITY_WARMUP_RECOVERY_EXERCISES was applied.","ANATOMY_SUPPORTED","ACCEPT_ANATOMY_SUPPORTED","The movement family, primary muscles, and program role are anatomically stable and conventional.","Anatomy support is sufficient for conventional app-internal classification; exact variant evidence is not claimed.","NO","NONE","SOURCE_ACCEPTED","SOURCE_VERIFICATION_ONLY"
"버피","ex_3f184ef9","category=기능성운동; movement_category=CONDITIONING; force_type=MIXED; movement_pattern=FULL_BODY_CONDITIONING|CARDIO|PLYOMETRIC_SUPPORT","FULL_BODY_CONDITIONING|CARDIO|PLYOMETRIC_SUPPORT","CONDITIONING","MIXED","EXERCISE","NOT_PRESENT_IN_SEED","BODYWEIGHT_CONDITIONING_POWER_REVIEW","BURPEE","REVIEW","REVIEW","REVIEW","REVIEW","REVIEW","REVIEW","REVIEW","REVIEW","REVIEW","NEEDS_SOURCE_TEMPLATE","heuristic_only","NEEDS_REVIEW","NO","YES","YES","NO","NO","NO","NO","NO","NO","NEEDS_ROW_REVIEW","Row family or subtype requires explicit human judgement before mutation.","CONFIRM_FAMILY_AND_SUBTYPE","Draft only; do not mutate seed without human approval. No approved family template; concrete muscle values were not invented.","NO","ACCEPTED_HEURISTIC","Approved compressed stress profile CARDIO_CONDITIONING_STRESS was applied with separate detail tags. Source verification remains separate and unresolved.","NONE","SOURCE_ONLY","ACCEPT_WITH_DOCUMENTED_SOURCE_LIMITATION","READY_AFTER_SOURCE_VERIFICATION","STRESS_REVIEW_REQUIRED","","BODYWEIGHT_CONDITIONING_POWER_REVIEW","BURPEE","REVIEW","REVIEW","REVIEW","","REVIEW","CARDIO_CONDITIONING_STRESS","REPEATED_PATTERN_LOAD/QUAD_LOAD/CORE_BRACING_LOAD/LANDING_LOAD","ACHILLES_TENDON_STRESS/PATELLAR_TENDON_STRESS","KNEE_VALGUS_CONTROL_STRESS","REPEATED_LOW_AMPLITUDE_IMPACT_STRESS","NONE","NONE","MEDIUM","HIGH","","","","","","STRESS","SOURCE_ACCEPTED_WITH_LIMITATION_DRAFT_ONLY","Approved compressed stress profile CARDIO_CONDITIONING_STRESS was applied with separate detail tags.","SOURCE_WEAK_BUT_ACCEPTABLE","ACCEPT_WEAK_SOURCE_WITH_LIMITATION","The draft classification is usable, but its sport-support or conditioning interpretation lacks a dedicated source template.","Accepted only for low-strength app-internal claims; no DIRECT transfer or causal performance claim is authorized.","NO","NONE","SOURCE_ACCEPTED_WITH_LIMITATION","SOURCE_VERIFICATION_ONLY"
"불가리안 스플릿 스쿼트","ex_e2efd0fe","category=기능성운동; movement_category=SUPPORT; force_type=LOWER_BODY; movement_pattern=KNEE_DOMINANT|LOWER_BODY_STRENGTH|SQUAT_PATTERN|UNILATERAL_LOWER|HIP_STABILITY_SUPPORT|DECELERATION_SUPPORT","KNEE_DOMINANT|LOWER_BODY_STRENGTH|SQUAT_PATTERN|UNILATERAL_LOWER|HIP_STABILITY_SUPPORT|DECELERATION_SUPPORT","SUPPORT","LOWER_BODY","EXERCISE","NOT_PRESENT_IN_SEED","LUNGE_SPLIT_SQUAT_VARIANTS","BULGARIAN_SPLIT_SQUAT","QUADRICEPS|RECTUS_FEMORIS|GLUTE_MAX|HAMSTRINGS|HIP_ADDUCTORS|GASTROCNEMIUS|SOLEUS|GLUTE_MED_MIN|DEEP_CORE|OBLIQUES|TIBIALIS_ANTERIOR","{""QUADRICEPS"":0.25,""RECTUS_FEMORIS"":0.1,""GLUTE_MAX"":0.25,""HAMSTRINGS"":0.1,""HIP_ADDUCTORS"":0.08,""GASTROCNEMIUS"":0.05,""SOLEUS"":0.05,""GLUTE_MED_MIN"":0.05,""DEEP_CORE"":0.04,""OBLIQUES"":0.03}","UNILATERAL_LOWER_STRENGTH","LUNGE_UNILATERAL_LOWER","VOLUME_LOAD","LOCAL_MUSCLE|SYSTEMIC_MODERATE|DECELERATION_REVIEW","LUNGE_REACH_REVIEW","HIP_STABILITY_SUPPORT|KNEE_CONTROL","FATIGUE|HYPERTROPHY_VOLUME|BADMINTON_TRANSFER_REVIEW|BALANCE","A_OPENSTAX_11_6|E_BADMINTON_LUNGE_PMC7648456|C_GLUTE_MED_MIN_META_PMC7727410","anatomy_textbook","MEDIUM","NO","NO","NO","NO","NO","NO","YES","YES","NO","NEEDS_SOURCE_REVIEW","Family is usable as a draft, but evidence source verification remains.","VERIFY_EXISTING_SOURCE_IDS","Draft only; do not mutate seed without human approval. Muscle contribution is an app-internal heuristic, not a physiological measurement. Sources need network recheck: E_BADMINTON_LUNGE_PMC7648456|C_GLUTE_MED_MIN_META_PMC7727410","NO","ANATOMY_SUPPORTED_TEMPLATE","Approved compressed stress profile UNILATERAL_LOWER_STABILITY_STRESS was applied with separate detail tags. Source verification remains separate and unresolved.","NONE","SOURCE_ONLY","ACCEPT_SOURCE_POLICY_DRAFT_ONLY","READY_AFTER_SOURCE_VERIFICATION","STRESS_REVIEW_REQUIRED","","LUNGE_SPLIT_SQUAT_VARIANTS","BULGARIAN_SPLIT_SQUAT","UNILATERAL_LOWER_STRENGTH","LUNGE_UNILATERAL_LOWER","VOLUME_LOAD","","FATIGUE|HYPERTROPHY_VOLUME|BADMINTON_TRANSFER_REVIEW|BALANCE","UNILATERAL_LOWER_STABILITY_STRESS","QUAD_LOAD/GLUTE_LOAD/UNILATERAL_CONTROL_LOAD/SINGLE_LEG_STABILITY_LOAD/HIP_CONTROL_LOAD","PATELLAR_TENDON_STRESS","KNEE_VALGUS_CONTROL_STRESS/HIP_ROTATIONAL_CONTROL_STRESS/LUMBOPELVIC_CONTROL_STRESS","NONE","NONE","NONE","MEDIUM","MODERATE","","","","","","STRESS","SOURCE_ACCEPTED_DRAFT_ONLY","Approved compressed stress profile UNILATERAL_LOWER_STABILITY_STRESS was applied with separate detail tags.","VERIFIED_FAMILY","ACCEPT_VERIFIED_FAMILY","The existing source group supports the movement or sport family at family level.","Acceptance does not claim that every equipment or stance variant was studied directly.","NO","NONE","SOURCE_ACCEPTED","SOURCE_VERIFICATION_ONLY"
"사이드 스텝 후 정지","ex_9b132c23","category=기능성운동; movement_category=AGILITY; force_type=AGILITY; movement_pattern=FOOTWORK_DIRECT|CHANGE_OF_DIRECTION_DIRECT|DECELERATION_DIRECT|REACTION_AGILITY_DIRECT|LATERAL_DECELERATION_DIRECT","FOOTWORK_DIRECT|CHANGE_OF_DIRECTION_DIRECT|DECELERATION_DIRECT|REACTION_AGILITY_DIRECT|LATERAL_DECELERATION_DIRECT","AGILITY","AGILITY","EXERCISE","NOT_PRESENT_IN_SEED","LATERAL_BOUND_LANDING_DECELERATION_VARIANTS","LATERAL_DECELERATION_STOP","GLUTE_MAX|GLUTE_MED_MIN|QUADRICEPS|GASTROCNEMIUS|SOLEUS|HAMSTRINGS|HIP_ADDUCTORS|TIBIALIS_ANTERIOR|DEEP_CORE|OBLIQUES","{""GLUTE_MAX"":0.18,""GLUTE_MED_MIN"":0.14,""QUADRICEPS"":0.18,""GASTROCNEMIUS"":0.12,""SOLEUS"":0.1,""HAMSTRINGS"":0.08,""HIP_ADDUCTORS"":0.08,""TIBIALIS_ANTERIOR"":0.05,""DEEP_CORE"":0.04,""OBLIQUES"":0.03}","DECELERATION_LANDING","LATERAL_DECELERATION_SSC","QUALITY_BASED","DECELERATION|ELASTIC_SSC|NEURAL_SPEED|LOCAL_MUSCLE","DECELERATION|JUMP_LANDING|LATERAL_MOVE","ANKLE_SSC_SUPPORT|KNEE_CONTROL","FATIGUE|BADMINTON_TRANSFER|BALANCE","B_NSCA_DECELERATION_RESOURCE|E_BADMINTON_LUNGE_PMC7648456","coaching_consensus","LOW","NO","NO","NO","NO","NO","NO","NO","PARTIAL","NO","NEEDS_STRESS_REVIEW","Axial, plyometric, deceleration, SSC, or session stress mapping needs review.","REVIEW_STRESS_AND_RECOVERY_MAPPING","Draft only; do not mutate seed without human approval. Muscle contribution is an app-internal heuristic, not a physiological measurement. Sources need network recheck: E_BADMINTON_LUNGE_PMC7648456","NO","ANATOMY_SUPPORTED_TEMPLATE","Approved compressed stress profile PLYOMETRIC_LANDING_STRESS was applied with separate detail tags. Source verification remains separate and unresolved.","NONE","SOURCE_ONLY","ACCEPT_SOURCE_POLICY_DRAFT_ONLY","READY_AFTER_SOURCE_VERIFICATION","STRESS_REVIEW_REQUIRED","","LATERAL_BOUND_LANDING_DECELERATION_VARIANTS","LATERAL_DECELERATION_STOP","DECELERATION_LANDING","LATERAL_DECELERATION_SSC","QUALITY_BASED","","FATIGUE|BADMINTON_TRANSFER|BALANCE","PLYOMETRIC_LANDING_STRESS","FRONTAL_PLANE_LOAD/DECELERATION_LOAD/LANDING_LOAD/SINGLE_LEG_STABILITY_LOAD/CALF_ANKLE_SSC_LOAD","ACHILLES_TENDON_STRESS/PATELLAR_TENDON_STRESS","ANKLE_INVERSION_LIGAMENT_STRESS/KNEE_VALGUS_CONTROL_STRESS/KNEE_ROTATIONAL_STABILITY_STRESS/HIP_ROTATIONAL_CONTROL_STRESS","DIRECTION_CHANGE_IMPACT_STRESS","NONE","NONE","LONG","HIGH","","","","","","STRESS","SOURCE_ACCEPTED_DRAFT_ONLY","Approved compressed stress profile PLYOMETRIC_LANDING_STRESS was applied with separate detail tags.","VERIFIED_FAMILY","ACCEPT_VERIFIED_FAMILY","The existing source group supports the movement or sport family at family level.","Acceptance does not claim that every equipment or stance variant was studied directly.","NO","NONE","SOURCE_ACCEPTED","SOURCE_VERIFICATION_ONLY"
"사이드 플랭크","ex_f6d43398","category=기능성운동; movement_category=SUPPORT; force_type=CORE; movement_pattern=CORE_STABILITY|ANTI_LATERAL_FLEXION|LUMBOPELVIC_CONTROL","CORE_STABILITY|ANTI_LATERAL_FLEXION|LUMBOPELVIC_CONTROL","SUPPORT","CORE","EXERCISE","NOT_PRESENT_IN_SEED","ANTI_ROTATION_ANTI_EXTENSION_CORE_VARIANTS","NEEDS_SUBTYPE_REVIEW","DEEP_CORE|OBLIQUES|RECTUS_ABDOMINIS|GLUTE_MAX|GLUTE_MED_MIN|SERRATUS_ANTERIOR|ERECTOR_SPINAE|ROTATOR_CUFF_EXTERNAL|HIP_ADDUCTORS","{""DEEP_CORE"":0.3,""OBLIQUES"":0.25,""RECTUS_ABDOMINIS"":0.15,""GLUTE_MED_MIN"":0.08,""GLUTE_MAX"":0.07,""SERRATUS_ANTERIOR"":0.05,""ERECTOR_SPINAE"":0.05,""HIP_ADDUCTORS"":0.05}","CORE_STABILITY","TRUNK_ANTI_MOVEMENT","QUALITY_BASED","ANTI_ROTATION|LOCAL_MUSCLE|LOW_SYSTEMIC","NONE","ANTI_ROTATION_STABILITY|TRUNK_CONTROL_SUPPORT","FATIGUE|BADMINTON_TRANSFER|BALANCE","A_OPENSTAX_10_2|E_CORE_BADMINTON_META_PMC11168634","anatomy_textbook","HIGH","NO","YES","NO","NO","NO","NO","NO","PARTIAL","NO","NEEDS_ROW_REVIEW","Cleanup demotion: READY_TEMPLATE_CANDIDATE requires resolved subtype, no REVIEW fields, no unresolved review flags, and template-safe defaults.","RESOLVE_READY_CLEANUP_VIOLATIONS","Draft only; do not mutate seed without human approval. Muscle contribution is an app-internal heuristic, not a physiological measurement. Subtype intentionally left for review; no broad exercise-name parsing was used.","CANDIDATE_AFTER_ROW_REVIEW","ANATOMY_SUPPORTED_TEMPLATE","Approved reusable template ANTI_ROTATION_ANTI_EXTENSION_CORE was applied.","NONE","NONE","KEEP_DRAFT_ONLY_FOR_FINAL_SEED_APPROVAL","READY_AFTER_TEMPLATE_DEFINITION","TEMPLATE_DEFINITION_REQUIRED","ANTI_ROTATION_ANTI_EXTENSION_CORE","ANTI_ROTATION_ANTI_EXTENSION_CORE","","CORE_STABILITY_ACCESSORY","CORE_BRACING_CONTROL","TIME_OR_REPS","CORE_BRACING_CONTROL","ACCESSORY_VOLUME/FATIGUE/BADMINTON_SUPPORTIVE","","","","","","","","","","","","","","","TEMPLATE","READY_AFTER_DECISION_PACK","Approved reusable template ANTI_ROTATION_ANTI_EXTENSION_CORE was applied.","","","","","","","",""
"셔틀런","ex_a4040be3","category=기능성운동; movement_category=AGILITY; force_type=AGILITY; movement_pattern=FOOTWORK_DIRECT|CHANGE_OF_DIRECTION_DIRECT|DECELERATION_DIRECT|REACTION_AGILITY_DIRECT","FOOTWORK_DIRECT|CHANGE_OF_DIRECTION_DIRECT|DECELERATION_DIRECT|REACTION_AGILITY_DIRECT","AGILITY","AGILITY","EXERCISE","NOT_PRESENT_IN_SEED","FOOTWORK_SPLIT_STEP_REACTION_DRILL_VARIANTS","NEEDS_SUBTYPE_REVIEW","GLUTE_MAX|GLUTE_MED_MIN|QUADRICEPS|GASTROCNEMIUS|SOLEUS|HAMSTRINGS|HIP_ADDUCTORS|TIBIALIS_ANTERIOR|DEEP_CORE|OBLIQUES","{""GLUTE_MAX"":0.15,""GLUTE_MED_MIN"":0.12,""QUADRICEPS"":0.18,""GASTROCNEMIUS"":0.12,""SOLEUS"":0.1,""HAMSTRINGS"":0.08,""HIP_ADDUCTORS"":0.1,""TIBIALIS_ANTERIOR"":0.05,""DEEP_CORE"":0.06,""OBLIQUES"":0.04}","BADMINTON_FOOTWORK","BADMINTON_COURT_FOOTWORK","TIME_OR_DISTANCE","NEURAL_SPEED|DECELERATION|ELASTIC_SSC|BADMINTON_COURT","FOOTWORK|REACTION|DECELERATION|LUNGE_REACH","ACCELERATION_SUPPORT|JUMP_LANDING_SUPPORT","FATIGUE|BADMINTON_TRANSFER|BALANCE","E_BWF_COACH_EDUCATION|E_BADMINTON_LUNGE_PMC7648456|B_NSCA_DECELERATION_RESOURCE","coaching_consensus","LOW","NO","NO","NO","YES","NO","NO","NO","PARTIAL","NO","NEEDS_STRESS_REVIEW","Axial, plyometric, deceleration, SSC, or session stress mapping needs review.","REVIEW_STRESS_AND_RECOVERY_MAPPING","Draft only; do not mutate seed without human approval. Muscle contribution is an app-internal heuristic, not a physiological measurement. Subtype intentionally left for review; no broad exercise-name parsing was used. Sources need network recheck: E_BADMINTON_LUNGE_PMC7648456","NO","ANATOMY_SUPPORTED_TEMPLATE","Approved conservative badminton transfer level SUPPORTIVE was applied. Source verification remains separate and unresolved.","NONE","SOURCE_ONLY","ACCEPT_SOURCE_POLICY_DRAFT_ONLY","READY_AFTER_SOURCE_VERIFICATION","SPORT_TRANSFER_REVIEW_REQUIRED","","FOOTWORK_SPLIT_STEP_REACTION_DRILL_VARIANTS","NEEDS_SUBTYPE_REVIEW","BADMINTON_FOOTWORK","BADMINTON_COURT_FOOTWORK","TIME_OR_DISTANCE","","FATIGUE|BADMINTON_TRANSFER|BALANCE","","","","","","MOTOR_LEARNING_LOAD","GENERAL_COURT_SPORT","","","SUPPORTIVE","LOWER_BODY_SUPPORTIVE/ANKLE_CALF_SSC_SUPPORTIVE","NONE","REACTIVE_AGILITY/DECELERATION/ANKLE_STIFFNESS","LOW","SPORT_TRANSFER","SOURCE_ACCEPTED_DRAFT_ONLY","Approved conservative badminton transfer level SUPPORTIVE was applied.","VERIFIED_FAMILY","ACCEPT_VERIFIED_FAMILY","The existing source group supports the movement or sport family at family level.","Acceptance does not claim that every equipment or stance variant was studied directly.","NO","NONE","SOURCE_ACCEPTED","SOURCE_VERIFICATION_ONLY"
"스캡 푸시업","ex_c4535de3","category=기능성운동; movement_category=STRENGTH; force_type=PUSH; movement_pattern=PUSH_HORIZONTAL|CHEST_STRENGTH","PUSH_HORIZONTAL|CHEST_STRENGTH","STRENGTH","PUSH","EXERCISE","NOT_PRESENT_IN_SEED","SERRATUS_SCAPULAR_PROTRACTION_CONTROL_VARIANTS","SCAPULAR_PUSH_UP","SERRATUS_ANTERIOR|TRAPEZIUS_LOWER|TRAPEZIUS_MIDDLE|DEEP_CORE|ROTATOR_CUFF_EXTERNAL","REVIEW","RECOVERY_PREHAB_SCAPULAR_CONTROL","SCAPULAR_PROTRACTION_CONTROL","QUALITY_BASED","LOW_LOCAL_MUSCLE/SCAPULAR_CONTROL/RECOVERY_PREHAB","NONE","SHOULDER_DURABILITY/SCAPULAR_CONTROL","RECOVERY_ONLY/BALANCE","A_OPENSTAX_11_5|D_SCAP_ROTATOR_CUFF_PMC2857390","anatomy_textbook","NEEDS_REVIEW","NO","NO","NO","NO","NO","NO","NO","YES","NO","READY_TEMPLATE_CANDIDATE","USER_JUDGEMENT_APPLIED","KEEP_DRAFT_ONLY_FOR_FUTURE_SEED_REVIEW","V2 taxonomy correction draft only. Muscle contribution is an app-internal heuristic, not a physiological measurement. Do not mutate seed without human approval. | USER_JUDGEMENT_APPLIED_2026-06-18","CANDIDATE_AFTER_ROW_REVIEW","ANATOMY_SUPPORTED_TEMPLATE","User resolved the family/subtype decision and the resulting template is anatomy-supported for app-internal use.","NONE","NONE","ACCEPT_AS_ANATOMY_SUPPORTED","NOT_READY","ANATOMY_SUPPORTED_TEMPLATE","","SERRATUS_SCAPULAR_PROTRACTION_CONTROL_VARIANTS","SCAPULAR_PUSH_UP","RECOVERY_PREHAB_SCAPULAR_CONTROL","SCAPULAR_PROTRACTION_CONTROL","QUALITY_BASED","","RECOVERY_ONLY/BALANCE","","","","","","","","","","","","","","","","NOT_IN_DECISION_PACK_SCOPE","","","","","","","","",""
"스케이터 스쿼트","ex_ee378da7","category=기능성운동; movement_category=SUPPORT; force_type=LOWER_BODY; movement_pattern=KNEE_DOMINANT|LOWER_BODY_STRENGTH|SQUAT_PATTERN|UNILATERAL_LOWER|HIP_STABILITY_SUPPORT|DECELERATION_SUPPORT","KNEE_DOMINANT|LOWER_BODY_STRENGTH|SQUAT_PATTERN|UNILATERAL_LOWER|HIP_STABILITY_SUPPORT|DECELERATION_SUPPORT","SUPPORT","LOWER_BODY","EXERCISE","NOT_PRESENT_IN_SEED","SQUAT_VARIANTS","SKATER_SQUAT","QUADRICEPS|RECTUS_FEMORIS|GLUTE_MAX|HAMSTRINGS|ERECTOR_SPINAE|GLUTE_MED_MIN|DEEP_CORE|OBLIQUES|HIP_ADDUCTORS","{""QUADRICEPS"":0.3,""RECTUS_FEMORIS"":0.1,""GLUTE_MAX"":0.25,""HAMSTRINGS"":0.08,""ERECTOR_SPINAE"":0.1,""DEEP_CORE"":0.07,""GLUTE_MED_MIN"":0.05,""HIP_ADDUCTORS"":0.05}","UNILATERAL_LOWER_ACCESSORY","SINGLE_LEG_SQUAT_STABILITY","VOLUME_LOAD","LOCAL_MUSCLE|KNEE_CONTROL|HIP_STABILITY|LOW_TO_MODERATE_SYSTEMIC","NONE","LOWER_STRENGTH_SUPPORT|KNEE_CONTROL|HIP_STABILITY_SUPPORT","FATIGUE|STRENGTH_PROGRESS|HYPERTROPHY_VOLUME|BALANCE","A_OPENSTAX_11_6|B_ACSM_2009_PMID19204579|B_NSCA_ESSENTIALS_5E|C_GLUTE_MAX_REVIEW_PMC7039033","governing_body_resource","NEEDS_REVIEW","NO","YES","NO","NO","NO","NO","NO","PARTIAL","NO","NEEDS_ROW_REVIEW","Accessory squat variant must not inherit heavy barbell slot or redundancy.","CONFIRM_ACCESSORY_SQUAT_SLOT","Draft only; do not mutate seed without human approval. Muscle contribution is an app-internal heuristic, not a physiological measurement. Subtype intentionally left for review; no broad exercise-name parsing was used.","CANDIDATE_AFTER_ROW_REVIEW","ANATOMY_SUPPORTED_TEMPLATE","일반적인 근력/보조 운동으로 movement family, 주요 근육군, program slot이 해부학적·관행적으로 안정적입니다.","NONE","NONE","ACCEPT_AS_ANATOMY_SUPPORTED","NOT_READY","ANATOMY_SUPPORTED_TEMPLATE","","SQUAT_VARIANTS","SKATER_SQUAT","UNILATERAL_LOWER_ACCESSORY","SINGLE_LEG_SQUAT_STABILITY","VOLUME_LOAD","","FATIGUE|STRENGTH_PROGRESS|HYPERTROPHY_VOLUME|BALANCE","","","","","","","","","","","","","","","","NOT_IN_DECISION_PACK_SCOPE","","","","","","","","",""
"스킵 바운드","ex_c4ea0a2a","category=기능성운동; movement_category=RUNNING_DRILL; force_type=PLYOMETRIC; movement_pattern=RUNNING_DRILL|SPRINT_MECHANICS_SUPPORT|HORIZONTAL_POWER|PLYOMETRIC_SSC","RUNNING_DRILL|SPRINT_MECHANICS_SUPPORT|HORIZONTAL_POWER|PLYOMETRIC_SSC","RUNNING_DRILL","PLYOMETRIC","EXERCISE","NOT_PRESENT_IN_SEED","RUNNING_MECHANICS_SUPPORT_REVIEW","NEEDS_SUBTYPE_REVIEW","REVIEW","REVIEW","RUNNING_MECHANICS_SUPPORT_REVIEW","RUNNING_MECHANICS_SUPPORT_REVIEW","QUALITY_BASED","NEURAL_SPEED_SUPPORT|ELASTIC_SSC_REVIEW","NONE","ACCELERATION_SUPPORT|ANKLE_STIFFNESS_SUPPORT|NEURAL_SPEED_SUPPORT","FATIGUE|BADMINTON_TRANSFER|BALANCE","NEEDS_SOURCE_TEMPLATE","heuristic_only","LOW","NO","NO","YES","YES","NO","NO","NO","NO","NO","NEEDS_TEMPLATE_DEFINITION","The proposed review family has no approved family template.","DEFINE_AND_REVIEW_FAMILY_TEMPLATE","Draft only; do not mutate seed without human approval. Subtype intentionally left for review; no broad exercise-name parsing was used. No approved family template; concrete muscle values were not invented.","NO","ACCEPTED_HEURISTIC","Approved conservative badminton transfer level SUPPORTIVE was applied. Source verification remains separate and unresolved.","NONE","SOURCE_ONLY","ACCEPT_WITH_DOCUMENTED_SOURCE_LIMITATION","READY_AFTER_SOURCE_VERIFICATION","SPORT_TRANSFER_REVIEW_REQUIRED","","RUNNING_MECHANICS_SUPPORT_REVIEW","NEEDS_SUBTYPE_REVIEW","RUNNING_MECHANICS_SUPPORT_REVIEW","RUNNING_MECHANICS_SUPPORT_REVIEW","QUALITY_BASED","","FATIGUE|BADMINTON_TRANSFER|BALANCE","","","","","","MOTOR_LEARNING_LOAD","NONE","","","SUPPORTIVE","LOWER_BODY_SUPPORTIVE/ANKLE_CALF_SSC_SUPPORTIVE","NONE","ACCELERATION/ANKLE_STIFFNESS/CALF_ELASTICITY/HIP_CONTROL","LOW","SPORT_TRANSFER","SOURCE_ACCEPTED_WITH_LIMITATION_DRAFT_ONLY","Approved conservative badminton transfer level SUPPORTIVE was applied.","SOURCE_WEAK_BUT_ACCEPTABLE","ACCEPT_WEAK_SOURCE_WITH_LIMITATION","The draft classification is usable, but its sport-support or conditioning interpretation lacks a dedicated source template.","Accepted only for low-strength app-internal claims; no DIRECT transfer or causal performance claim is authorized.","NO","NONE","SOURCE_ACCEPTED_WITH_LIMITATION","SOURCE_VERIFICATION_ONLY"
"스트라이드","ex_c5c2fdef","category=기능성운동; movement_category=RUNNING_DRILL; force_type=LOWER_BODY; movement_pattern=RUNNING_DRILL|SPRINT_MECHANICS_SUPPORT|ACCELERATION_SUPPORT|RUNNING_RHYTHM","RUNNING_DRILL|SPRINT_MECHANICS_SUPPORT|ACCELERATION_SUPPORT|RUNNING_RHYTHM","RUNNING_DRILL","LOWER_BODY","EXERCISE","NOT_PRESENT_IN_SEED","RUNNING_MECHANICS_SUPPORT_REVIEW","NEEDS_SUBTYPE_REVIEW","REVIEW","REVIEW","RUNNING_MECHANICS_SUPPORT_REVIEW","RUNNING_MECHANICS_SUPPORT_REVIEW","QUALITY_BASED","NEURAL_SPEED_SUPPORT|ELASTIC_SSC_REVIEW","NONE","ACCELERATION_SUPPORT|ANKLE_STIFFNESS_SUPPORT|NEURAL_SPEED_SUPPORT","FATIGUE|BADMINTON_TRANSFER|BALANCE","NEEDS_SOURCE_TEMPLATE","heuristic_only","LOW","NO","NO","YES","NO","NO","NO","NO","NO","NO","NEEDS_TEMPLATE_DEFINITION","The proposed review family has no approved family template.","DEFINE_AND_REVIEW_FAMILY_TEMPLATE","Draft only; do not mutate seed without human approval. Subtype intentionally left for review; no broad exercise-name parsing was used. No approved family template; concrete muscle values were not invented.","NO","ACCEPTED_HEURISTIC","Approved conservative badminton transfer level SUPPORTIVE was applied. Source verification remains separate and unresolved.","NONE","SOURCE_ONLY","ACCEPT_WITH_DOCUMENTED_SOURCE_LIMITATION","READY_AFTER_SOURCE_VERIFICATION","SPORT_TRANSFER_REVIEW_REQUIRED","","RUNNING_MECHANICS_SUPPORT_REVIEW","NEEDS_SUBTYPE_REVIEW","RUNNING_MECHANICS_SUPPORT_REVIEW","RUNNING_MECHANICS_SUPPORT_REVIEW","QUALITY_BASED","","FATIGUE|BADMINTON_TRANSFER|BALANCE","","","","","","MOTOR_LEARNING_LOAD","NONE","","","SUPPORTIVE","LOWER_BODY_SUPPORTIVE/ANKLE_CALF_SSC_SUPPORTIVE","NONE","ACCELERATION/ANKLE_STIFFNESS/CALF_ELASTICITY/HIP_CONTROL","LOW","SPORT_TRANSFER","SOURCE_ACCEPTED_WITH_LIMITATION_DRAFT_ONLY","Approved conservative badminton transfer level SUPPORTIVE was applied.","SOURCE_WEAK_BUT_ACCEPTABLE","ACCEPT_WEAK_SOURCE_WITH_LIMITATION","The draft classification is usable, but its sport-support or conditioning interpretation lacks a dedicated source template.","Accepted only for low-strength app-internal claims; no DIRECT transfer or causal performance claim is authorized.","NO","NONE","SOURCE_ACCEPTED_WITH_LIMITATION","SOURCE_VERIFICATION_ONLY"
