"캡틴체어 레그 레이즈","ex_a345e30b","category=근력운동; movement_category=ACCESSORY; force_type=CORE; movement_pattern=CORE_FLEXION|ANTERIOR_CORE|HIP_FLEXOR_ACCESSORY","CORE_FLEXION|ANTERIOR_CORE|HIP_FLEXOR_ACCESSORY","ACCESSORY","CORE","EXERCISE","NOT_PRESENT_IN_SEED","CORE_FLEXION_HIP_FLEXOR_REVIEW","CAPTAINS_CHAIR_LEG_RAISE","REVIEW","REVIEW","REVIEW","REVIEW","REVIEW","REVIEW","REVIEW","REVIEW","REVIEW","NEEDS_SOURCE_TEMPLATE","heuristic_only","NEEDS_REVIEW","NO","YES","NO","NO","NO","NO","NO","NO","NO","NEEDS_ROW_REVIEW","Row family or subtype requires explicit human judgement before mutation.","CONFIRM_FAMILY_AND_SUBTYPE","Draft only; do not mutate seed without human approval. No approved family template; concrete muscle values were not invented.","NO","ACCEPTED_HEURISTIC","Approved reusable template CORE_FLEXION_ANTERIOR_CORE was applied. Source verification remains separate and unresolved.","NONE","SOURCE_ONLY","ACCEPT_AS_APP_INTERNAL_HEURISTIC","READY_AFTER_SOURCE_VERIFICATION","TEMPLATE_DEFINITION_REQUIRED","CORE_FLEXION_ANTERIOR_CORE","CORE_FLEXION_ANTERIOR_CORE","CAPTAINS_CHAIR_LEG_RAISE","CORE_FLEXION_ACCESSORY","ANTERIOR_CORE_FLEXION","REPS_OR_TIME","ANTERIOR_CORE_FLEXION","ACCESSORY_VOLUME/FATIGUE","","","","","","","","","","","","","","","TEMPLATE","SOURCE_ACCEPTED_DRAFT_ONLY","Approved reusable template CORE_FLEXION_ANTERIOR_CORE was applied.","HEURISTIC_ACCEPTED","ACCEPT_HEURISTIC","The movement classification is suitable as an app-internal heuristic and does not require exact exercise evidence.","No exact efficacy, injury, or sport-transfer claim is inferred.","NO","NONE","SOURCE_ACCEPTED","SOURCE_VERIFICATION_ONLY"
"컨센트레이션 컬","ex_c62c0716","category=근력운동; movement_category=ACCESSORY; force_type=ISOLATION; movement_pattern=ELBOW_FLEXION|BICEPS_ACCESSORY|FOREARM_GRIP_SUPPORT|BICEPS_ISOLATION_STRICT","ELBOW_FLEXION|BICEPS_ACCESSORY|FOREARM_GRIP_SUPPORT|BICEPS_ISOLATION_STRICT","ACCESSORY","ISOLATION","EXERCISE","NOT_PRESENT_IN_SEED","ELBOW_FLEXION_BICEPS_CURL_VARIANTS","CONCENTRATION_CURL","BICEPS_BRACHII|BRACHIALIS|BRACHIORADIALIS|FOREARM_FLEXORS|GRIP_FLEXORS|DEEP_CORE","{""BICEPS_BRACHII"":0.45,""BRACHIALIS"":0.18,""BRACHIORADIALIS"":0.12,""FOREARM_FLEXORS"":0.10,""GRIP_FLEXORS"":0.08,""DEEP_CORE"":0.07}","BICEPS_ACCESSORY","ELBOW_FLEXION_CURL","VOLUME_LOAD","LOCAL_MUSCLE|ELBOW_FLEXION|GRIP_FOREARM_LOW_TO_MODERATE|LOW_SYSTEMIC","NONE","GRIP_FOREARM_SUPPORT_WHEN_MEANINGFUL","FATIGUE|HYPERTROPHY_VOLUME|BADMINTON_TRANSFER|BALANCE","A_OPENSTAX_11_5|E_BADMINTON_INJURY_PMC7205924","anatomy_textbook","MEDIUM","NO","NO","NO","NO","NO","NO","YES","YES","NO","NEEDS_SOURCE_REVIEW","Arm family is corrected; badminton-support source still needs network recheck.","VERIFY_EXISTING_SOURCE_IDS","V2 taxonomy correction draft only. Muscle contribution is an app-internal heuristic, not a physiological measurement. Do not mutate seed without human approval.","NO","ANATOMY_SUPPORTED_TEMPLATE","운동 family와 program slot은 통상적 분류로 안정적이며, 남은 작업은 evidence source ID 확인입니다.","NONE","SOURCE_ONLY","ACCEPT_SOURCE_POLICY_DRAFT_ONLY","READY_AFTER_SOURCE_VERIFICATION","SOURCE_VERIFICATION_ONLY","","ELBOW_FLEXION_BICEPS_CURL_VARIANTS","CONCENTRATION_CURL","BICEPS_ACCESSORY","ELBOW_FLEXION_CURL","VOLUME_LOAD","","FATIGUE|HYPERTROPHY_VOLUME|BADMINTON_TRANSFER|BALANCE","","","","","","","","","","","","","","","","SOURCE_ACCEPTED_DRAFT_ONLY","","ANATOMY_SUPPORTED","ACCEPT_ANATOMY_SUPPORTED","The movement family, primary muscles, and program role are anatomically stable and conventional.","The badminton injury source is contextual only; anatomy support, not that injury source, carries the ordinary exercise classification.","NO","NONE","SOURCE_ACCEPTED","SOURCE_VERIFICATION_ONLY"
"케이블 래터럴 레이즈","ex_b76d3f92","category=근력운동; movement_category=ACCESSORY; force_type=ISOLATION; movement_pattern=SHOULDER_ABDUCTION|SHOULDER_ISOLATION|SHOULDER_ACCESSORY","SHOULDER_ABDUCTION|SHOULDER_ISOLATION|SHOULDER_ACCESSORY","ACCESSORY","ISOLATION","EXERCISE","NOT_PRESENT_IN_SEED","LATERAL_RAISE_DELTOID_ISOLATION_VARIANTS","CABLE_LATERAL_RAISE","LATERAL_DELTOID|SUPRASPINATUS|TRAPEZIUS_UPPER|SERRATUS_ANTERIOR|ROTATOR_CUFF_EXTERNAL|DEEP_CORE","{""LATERAL_DELTOID"":0.45,""SUPRASPINATUS"":0.12,""TRAPEZIUS_UPPER"":0.12,""SERRATUS_ANTERIOR"":0.10,""ROTATOR_CUFF_EXTERNAL"":0.12,""DEEP_CORE"":0.09}","SHOULDER_ACCESSORY","LATERAL_DELTOID_ISOLATION","VOLUME_LOAD","LOCAL_MUSCLE|LOW_SYSTEMIC","NONE","SHOULDER_DURABILITY_REVIEW","FATIGUE|HYPERTROPHY_VOLUME|BALANCE","A_OPENSTAX_11_5|D_SCAP_ROTATOR_CUFF_PMC2857390","anatomy_textbook","NEEDS_REVIEW","NO","YES","NO","NO","NO","NO","YES","PARTIAL","NO","NEEDS_SOURCE_REVIEW","Lateral raise is split from rear-delt horizontal abduction to avoid mixed muscle contribution.","VERIFY_LATERAL_RAISE_SOURCE_TEMPLATE","Draft only; do not mutate seed without human approval. Muscle contribution is an app-internal heuristic, not a physiological measurement. Subtype intentionally left for review; no broad exercise-name parsing was used. Sources need network recheck: D_SCAP_ROTATOR_CUFF_PMC2857390 V3 correction: draft/report-only taxonomy patch; do not mutate seed without human approval.","NO","ANATOMY_SUPPORTED_TEMPLATE","운동 family와 program slot은 통상적 분류로 안정적이며, 남은 작업은 evidence source ID 확인입니다.","NONE","SOURCE_ONLY","ACCEPT_SOURCE_POLICY_DRAFT_ONLY","READY_AFTER_SOURCE_VERIFICATION","SOURCE_VERIFICATION_ONLY","","LATERAL_RAISE_DELTOID_ISOLATION_VARIANTS","CABLE_LATERAL_RAISE","SHOULDER_ACCESSORY","LATERAL_DELTOID_ISOLATION","VOLUME_LOAD","","FATIGUE|HYPERTROPHY_VOLUME|BALANCE","","","","","","","","","","","","","","","","SOURCE_ACCEPTED_DRAFT_ONLY","","VERIFIED_FAMILY","ACCEPT_VERIFIED_FAMILY","The existing source group supports the movement or sport family at family level.","Acceptance does not claim that every equipment or stance variant was studied directly.","NO","NONE","SOURCE_ACCEPTED","SOURCE_VERIFICATION_ONLY"
"케이블 로우","ex_fa31f7a6","category=근력운동; movement_category=STRENGTH; force_type=PULL; movement_pattern=PULL_HORIZONTAL|BACK_STRENGTH|SCAPULAR_RETRACTION","PULL_HORIZONTAL|BACK_STRENGTH|SCAPULAR_RETRACTION","STRENGTH","PULL","EXERCISE","NOT_PRESENT_IN_SEED","ROW_VARIANTS","NEEDS_SUBTYPE_REVIEW","LATISSIMUS_DORSI|RHOMBOIDS|TRAPEZIUS_MIDDLE|POSTERIOR_DELTOID|BICEPS_BRACHII|BRACHIALIS|BRACHIORADIALIS|TRAPEZIUS_LOWER|ROTATOR_CUFF_EXTERNAL|GRIP_FLEXORS|DEEP_CORE|OBLIQUES","{""LATISSIMUS_DORSI"":0.25,""RHOMBOIDS"":0.15,""TRAPEZIUS_MIDDLE"":0.15,""POSTERIOR_DELTOID"":0.12,""BICEPS_BRACHII"":0.1,""BRACHIALIS"":0.05,""BRACHIORADIALIS"":0.04,""GRIP_FLEXORS"":0.05,""TRAPEZIUS_LOWER"":0.04,""DEEP_CORE"":0.03,""OBLIQUES"":0.02}","HORIZONTAL_PULL_STRENGTH","HORIZONTAL_PULL_COMPOUND","VOLUME_LOAD","LOCAL_MUSCLE|NEURAL_HEAVY_MODERATE_REVIEW|GRIP_FOREARM|ANTI_ROTATION_UNILATERAL_REVIEW","NONE","SHOULDER_DURABILITY|ANTI_ROTATION_STABILITY|GRIP_FOREARM","FATIGUE|STRENGTH_PROGRESS|HYPERTROPHY_VOLUME|BADMINTON_TRANSFER|BALANCE","A_OPENSTAX_11_5","anatomy_textbook","NEEDS_REVIEW","NO","YES","NO","NO","NO","NO","NO","PARTIAL","NO","NEEDS_ROW_REVIEW","Row family or subtype requires explicit human judgement before mutation.","CONFIRM_FAMILY_AND_SUBTYPE","Draft only; do not mutate seed without human approval. Muscle contribution is an app-internal heuristic, not a physiological measurement. Subtype intentionally left for review; no broad exercise-name parsing was used. Inverted-row evidence is retained, but non-inverted row subtype needs manual source review. Sources need network recheck: D_SCAP_ROTATOR_CUFF_PMC2857390","NO","ACCEPTED_HEURISTIC","Approved compressed stress profile HORIZONTAL_ROW_STRESS was applied with separate detail tags. Source verification remains separate and unresolved.","NONE","SOURCE_ONLY","ACCEPT_WITH_DOCUMENTED_SOURCE_LIMITATION","READY_AFTER_SOURCE_VERIFICATION","STRESS_REVIEW_REQUIRED","","ROW_VARIANTS","NEEDS_SUBTYPE_REVIEW","HORIZONTAL_PULL_STRENGTH","HORIZONTAL_PULL_COMPOUND","VOLUME_LOAD","","FATIGUE|STRENGTH_PROGRESS|HYPERTROPHY_VOLUME|BADMINTON_TRANSFER|BALANCE","HORIZONTAL_ROW_STRESS","LAT_LOAD/UPPER_BACK_LOAD/REAR_DELTOID_LOAD/BICEPS_LOAD/GRIP_LOAD/SCAPULAR_STABILITY_LOAD","BICEPS_TENDON_STRESS/FOREARM_FLEXOR_TENDON_STRESS","SHOULDER_JOINT_STABILITY_STRESS/ELBOW_JOINT_STRESS","NONE","NONE","NONE","MEDIUM","MODERATE","","","","","","STRESS","SOURCE_ACCEPTED_WITH_LIMITATION_DRAFT_ONLY","Approved compressed stress profile HORIZONTAL_ROW_STRESS was applied with separate detail tags.","SOURCE_WEAK_BUT_ACCEPTABLE","ACCEPT_WEAK_SOURCE_WITH_LIMITATION","User-approved practical support closes cable row classification without subtype-specific physiology claims.","Accepted as a cable horizontal-row / cable high-row family classification. Seated-row and machine-row practical sources support broad lats, rhomboids, traps, rear-deltoid and biceps involvement, but no exact subtype EMG claim is made.","NO","NONE","SOURCE_ACCEPTED_WITH_LIMITATION","SOURCE_VERIFICATION_ONLY"
"케이블 원암 로우","ex_3c3692aa","category=근력운동; movement_category=STRENGTH; force_type=PULL; movement_pattern=PULL_HORIZONTAL|BACK_STRENGTH|SCAPULAR_RETRACTION|UNILATERAL_UPPER","PULL_HORIZONTAL|BACK_STRENGTH|SCAPULAR_RETRACTION|UNILATERAL_UPPER","STRENGTH","PULL","EXERCISE","NOT_PRESENT_IN_SEED","ROW_VARIANTS","NEEDS_SUBTYPE_REVIEW","LATISSIMUS_DORSI|RHOMBOIDS|TRAPEZIUS_MIDDLE|POSTERIOR_DELTOID|BICEPS_BRACHII|BRACHIALIS|BRACHIORADIALIS|TRAPEZIUS_LOWER|ROTATOR_CUFF_EXTERNAL|GRIP_FLEXORS|DEEP_CORE|OBLIQUES","{""LATISSIMUS_DORSI"":0.25,""RHOMBOIDS"":0.15,""TRAPEZIUS_MIDDLE"":0.15,""POSTERIOR_DELTOID"":0.12,""BICEPS_BRACHII"":0.1,""BRACHIALIS"":0.05,""BRACHIORADIALIS"":0.04,""GRIP_FLEXORS"":0.05,""TRAPEZIUS_LOWER"":0.04,""DEEP_CORE"":0.03,""OBLIQUES"":0.02}","HORIZONTAL_PULL_STRENGTH","HORIZONTAL_PULL_COMPOUND","VOLUME_LOAD","LOCAL_MUSCLE|NEURAL_HEAVY_MODERATE_REVIEW|GRIP_FOREARM|ANTI_ROTATION_UNILATERAL_REVIEW","NONE","SHOULDER_DURABILITY|ANTI_ROTATION_STABILITY|GRIP_FOREARM","FATIGUE|STRENGTH_PROGRESS|HYPERTROPHY_VOLUME|BADMINTON_TRANSFER|BALANCE","A_OPENSTAX_11_5","anatomy_textbook","NEEDS_REVIEW","NO","YES","NO","NO","NO","NO","NO","PARTIAL","NO","NEEDS_ROW_REVIEW","Row family or subtype requires explicit human judgement before mutation.","CONFIRM_FAMILY_AND_SUBTYPE","Draft only; do not mutate seed without human approval. Muscle contribution is an app-internal heuristic, not a physiological measurement. Subtype intentionally left for review; no broad exercise-name parsing was used. Inverted-row evidence is retained, but non-inverted row subtype needs manual source review. Sources need network recheck: D_SCAP_ROTATOR_CUFF_PMC2857390","NO","ACCEPTED_HEURISTIC","Approved compressed stress profile HORIZONTAL_ROW_STRESS was applied with separate detail tags. Source verification remains separate and unresolved.","NONE","SOURCE_ONLY","ACCEPT_WITH_DOCUMENTED_SOURCE_LIMITATION","READY_AFTER_SOURCE_VERIFICATION","STRESS_REVIEW_REQUIRED","","ROW_VARIANTS","NEEDS_SUBTYPE_REVIEW","HORIZONTAL_PULL_STRENGTH","HORIZONTAL_PULL_COMPOUND","VOLUME_LOAD","","FATIGUE|STRENGTH_PROGRESS|HYPERTROPHY_VOLUME|BADMINTON_TRANSFER|BALANCE","HORIZONTAL_ROW_STRESS","LAT_LOAD/UPPER_BACK_LOAD/REAR_DELTOID_LOAD/BICEPS_LOAD/GRIP_LOAD/SCAPULAR_STABILITY_LOAD","BICEPS_TENDON_STRESS/FOREARM_FLEXOR_TENDON_STRESS","SHOULDER_JOINT_STABILITY_STRESS/ELBOW_JOINT_STRESS","NONE","NONE","NONE","MEDIUM","MODERATE","","","","","","STRESS","SOURCE_ACCEPTED_WITH_LIMITATION_DRAFT_ONLY","Approved compressed stress profile HORIZONTAL_ROW_STRESS was applied with separate detail tags.","SOURCE_WEAK_BUT_ACCEPTABLE","ACCEPT_WEAK_SOURCE_WITH_LIMITATION","User-approved practical support closes cable row classification without subtype-specific physiology claims.","Accepted as a cable horizontal-row / cable high-row family classification. Seated-row and machine-row practical sources support broad lats, rhomboids, traps, rear-deltoid and biceps involvement, but no exact subtype EMG claim is made.","NO","NONE","SOURCE_ACCEPTED_WITH_LIMITATION","SOURCE_VERIFICATION_ONLY"
"케이블 원암 트라이셉스 익스텐션","ex_eb636bac","category=근력운동; movement_category=ACCESSORY; force_type=ISOLATION; movement_pattern=ELBOW_EXTENSION|TRICEPS_ISOLATION|ARM_ACCESSORY|UNILATERAL_UPPER","ELBOW_EXTENSION|TRICEPS_ISOLATION|ARM_ACCESSORY|UNILATERAL_UPPER","ACCESSORY","ISOLATION","EXERCISE","NOT_PRESENT_IN_SEED","ELBOW_EXTENSION_TRICEPS_ISOLATION_VARIANTS","CABLE_ONE_ARM_TRICEPS_EXTENSION","TRICEPS_BRACHII|TRICEPS_LONG_HEAD|TRICEPS_LATERAL_MEDIAL|FOREARM_STABILIZERS|DEEP_CORE","{""TRICEPS_BRACHII"":0.45,""TRICEPS_LONG_HEAD"":0.20,""TRICEPS_LATERAL_MEDIAL"":0.20,""FOREARM_STABILIZERS"":0.07,""DEEP_CORE"":0.08}","TRICEPS_ACCESSORY","ELBOW_EXTENSION_TRICEPS","VOLUME_LOAD","LOCAL_MUSCLE|ELBOW_EXTENSION|LOW_SYSTEMIC","NONE","UPPER_PUSH_SUPPORT_IF_NEEDED","FATIGUE|HYPERTROPHY_VOLUME|BALANCE","A_OPENSTAX_11_5","anatomy_textbook","HIGH","NO","NO","NO","NO","NO","NO","YES","YES","NO","READY_TEMPLATE_CANDIDATE","Stable elbow-extension template is separated from biceps and forearm rows.","HUMAN_APPROVE_TEMPLATE_BEFORE_SEED_PATCH","V2 taxonomy correction draft only. Muscle contribution is an app-internal heuristic, not a physiological measurement. Do not mutate seed without human approval.","CANDIDATE_AFTER_HUMAN_TEMPLATE_APPROVAL","ANATOMY_SUPPORTED_TEMPLATE","일반적인 근력/보조 운동으로 movement family, 주요 근육군, program slot이 해부학적·관행적으로 안정적입니다.","NONE","NONE","ACCEPT_AS_ANATOMY_SUPPORTED","NOT_READY","ANATOMY_SUPPORTED_TEMPLATE","","ELBOW_EXTENSION_TRICEPS_ISOLATION_VARIANTS","CABLE_ONE_ARM_TRICEPS_EXTENSION","TRICEPS_ACCESSORY","ELBOW_EXTENSION_TRICEPS","VOLUME_LOAD","","FATIGUE|HYPERTROPHY_VOLUME|BALANCE","","","","","","","","","","","","","","","","NOT_IN_DECISION_PACK_SCOPE","","","","","","","","",""
"케이블 컬","ex_e709eeda","category=근력운동; movement_category=ACCESSORY; force_type=ISOLATION; movement_pattern=ELBOW_FLEXION|BICEPS_ACCESSORY|FOREARM_GRIP_SUPPORT","ELBOW_FLEXION|BICEPS_ACCESSORY|FOREARM_GRIP_SUPPORT","ACCESSORY","ISOLATION","EXERCISE","NOT_PRESENT_IN_SEED","ELBOW_FLEXION_BICEPS_CURL_VARIANTS","CABLE_CURL","BICEPS_BRACHII|BRACHIALIS|BRACHIORADIALIS|FOREARM_FLEXORS|GRIP_FLEXORS|DEEP_CORE","{""BICEPS_BRACHII"":0.45,""BRACHIALIS"":0.18,""BRACHIORADIALIS"":0.12,""FOREARM_FLEXORS"":0.10,""GRIP_FLEXORS"":0.08,""DEEP_CORE"":0.07}","BICEPS_ACCESSORY","ELBOW_FLEXION_CURL","VOLUME_LOAD","LOCAL_MUSCLE|ELBOW_FLEXION|GRIP_FOREARM_LOW_TO_MODERATE|LOW_SYSTEMIC","NONE","GRIP_FOREARM_SUPPORT_WHEN_MEANINGFUL","FATIGUE|HYPERTROPHY_VOLUME|BADMINTON_TRANSFER|BALANCE","A_OPENSTAX_11_5|E_BADMINTON_INJURY_PMC7205924","anatomy_textbook","MEDIUM","NO","NO","NO","NO","NO","NO","YES","YES","NO","NEEDS_SOURCE_REVIEW","Arm family is corrected; badminton-support source still needs network recheck.","VERIFY_EXISTING_SOURCE_IDS","V2 taxonomy correction draft only. Muscle contribution is an app-internal heuristic, not a physiological measurement. Do not mutate seed without human approval.","NO","ANATOMY_SUPPORTED_TEMPLATE","운동 family와 program slot은 통상적 분류로 안정적이며, 남은 작업은 evidence source ID 확인입니다.","NONE","SOURCE_ONLY","ACCEPT_SOURCE_POLICY_DRAFT_ONLY","READY_AFTER_SOURCE_VERIFICATION","SOURCE_VERIFICATION_ONLY","","ELBOW_FLEXION_BICEPS_CURL_VARIANTS","CABLE_CURL","BICEPS_ACCESSORY","ELBOW_FLEXION_CURL","VOLUME_LOAD","","FATIGUE|HYPERTROPHY_VOLUME|BADMINTON_TRANSFER|BALANCE","","","","","","","","","","","","","","","","SOURCE_ACCEPTED_DRAFT_ONLY","","ANATOMY_SUPPORTED","ACCEPT_ANATOMY_SUPPORTED","The movement family, primary muscles, and program role are anatomically stable and conventional.","The badminton injury source is contextual only; anatomy support, not that injury source, carries the ordinary exercise classification.","NO","NONE","SOURCE_ACCEPTED","SOURCE_VERIFICATION_ONLY"
"케이블 킥백","ex_fa34ddfe","category=근력운동; movement_category=ACCESSORY; force_type=ISOLATION; movement_pattern=HIP_EXTENSION|GLUTE_ISOLATION|POSTERIOR_CHAIN_ACCESSORY|UNILATERAL_LOWER","HIP_EXTENSION|GLUTE_ISOLATION|POSTERIOR_CHAIN_ACCESSORY|UNILATERAL_LOWER","ACCESSORY","ISOLATION","EXERCISE","NOT_PRESENT_IN_SEED","GLUTE_ISOLATION_ACCESSORY_REVIEW","CABLE_GLUTE_KICKBACK","REVIEW","REVIEW","REVIEW","REVIEW","REVIEW","REVIEW","REVIEW","REVIEW","REVIEW","NEEDS_SOURCE_TEMPLATE","heuristic_only","NEEDS_REVIEW","NO","YES","NO","NO","NO","NO","NO","NO","NO","NEEDS_ROW_REVIEW","Row family or subtype requires explicit human judgement before mutation.","CONFIRM_FAMILY_AND_SUBTYPE","Draft only; do not mutate seed without human approval. No approved family template; concrete muscle values were not invented.","NO","ANATOMY_SUPPORTED_TEMPLATE","The approved template resolves classification; evidence source verification remains separate.","NONE","SOURCE_ONLY","ACCEPT_SOURCE_POLICY_DRAFT_ONLY","READY_AFTER_SOURCE_VERIFICATION","TEMPLATE_DEFINITION_REQUIRED","GLUTE_ISOLATION_ACCESSORY","GLUTE_ISOLATION_ACCESSORY","CABLE_KICKBACK","GLUTE_ACCESSORY","GLUTE_ISOLATION_ACCESSORY","LOAD_REPS","GLUTE_ISOLATION_ACCESSORY","HYPERTROPHY_VOLUME | FATIGUE","","","","","","","","","","","","","","","TEMPLATE_GAP","SOURCE_ACCEPTED_DRAFT_ONLY","Approved template applied; source verification was not performed.","ANATOMY_SUPPORTED","ACCEPT_ANATOMY_SUPPORTED","The ordinary movement and muscle classification is anatomically stable despite the missing exercise-specific source template.","Acceptance is limited to conventional family, muscle, slot, and volume metadata.","NO","NONE","SOURCE_ACCEPTED","SOURCE_VERIFICATION_ONLY"
"케이블 풀스루","ex_4c76dbb2","category=근력운동; movement_category=STRENGTH; force_type=HINGE; movement_pattern=HIP_HINGE|POSTERIOR_CHAIN_STRENGTH","HIP_HINGE|POSTERIOR_CHAIN_STRENGTH","STRENGTH","HINGE","EXERCISE","NOT_PRESENT_IN_SEED","DEADLIFT_HINGE_VARIANTS","CABLE_PULL_THROUGH","GLUTE_MAX|HAMSTRINGS|ERECTOR_SPINAE|LATISSIMUS_DORSI|GRIP_FLEXORS|TRAPEZIUS_MIDDLE|DEEP_CORE|GLUTE_MED_MIN|OBLIQUES|RHOMBOIDS","{""GLUTE_MAX"":0.25,""HAMSTRINGS"":0.25,""ERECTOR_SPINAE"":0.2,""LATISSIMUS_DORSI"":0.08,""GRIP_FLEXORS"":0.07,""DEEP_CORE"":0.07,""TRAPEZIUS_MIDDLE"":0.04,""GLUTE_MED_MIN"":0.04}","POSTERIOR_CHAIN_ACCESSORY","HIP_EXTENSION_ACCESSORY","VOLUME_LOAD","LOCAL_MUSCLE|POSTERIOR_CHAIN|LOW_TO_MODERATE_SYSTEMIC","NONE","POSTERIOR_CHAIN_CAPACITY|HIP_STABILITY_SUPPORT","FATIGUE|STRENGTH_PROGRESS|HYPERTROPHY_VOLUME|BALANCE","A_OPENSTAX_11_6|C_DEADLIFT_EMG_PMC7046193|C_GLUTE_MAX_REVIEW_PMC7039033","anatomy_textbook","NEEDS_REVIEW","NO","YES","NO","NO","NO","NO","NO","PARTIAL","NO","NEEDS_ROW_REVIEW","Cable pull-through is an accessory, not a main heavy hinge.","CONFIRM_POSTERIOR_CHAIN_ACCESSORY_TEMPLATE","Draft only; do not mutate seed without human approval. Muscle contribution is an app-internal heuristic, not a physiological measurement. Subtype intentionally left for review; no broad exercise-name parsing was used.","CANDIDATE_AFTER_ROW_REVIEW","ANATOMY_SUPPORTED_TEMPLATE","일반적인 근력/보조 운동으로 movement family, 주요 근육군, program slot이 해부학적·관행적으로 안정적입니다.","NONE","NONE","ACCEPT_AS_ANATOMY_SUPPORTED","NOT_READY","ANATOMY_SUPPORTED_TEMPLATE","","DEADLIFT_HINGE_VARIANTS","CABLE_PULL_THROUGH","POSTERIOR_CHAIN_ACCESSORY","HIP_EXTENSION_ACCESSORY","VOLUME_LOAD","","FATIGUE|STRENGTH_PROGRESS|HYPERTROPHY_VOLUME|BALANCE","","","","","","","","","","","","","","","","NOT_IN_DECISION_PACK_SCOPE","","","","","","","","",""
"케이블 플라이","ex_4c779df2","category=근력운동; movement_category=ACCESSORY; force_type=PUSH; movement_pattern=CHEST_FLY|CHEST_ACCESSORY|SHOULDER_HORIZONTAL_ADDUCTION","CHEST_FLY|CHEST_ACCESSORY|SHOULDER_HORIZONTAL_ADDUCTION","ACCESSORY","PUSH","EXERCISE","NOT_PRESENT_IN_SEED","CHEST_ISOLATION_REVIEW","NEEDS_SUBTYPE_REVIEW","REVIEW","REVIEW","CHEST_ISOLATION_REVIEW","CHEST_ISOLATION_REVIEW","REVIEW","LOCAL_MUSCLE","NONE","UPPER_PUSH_SUPPORT","FATIGUE|HYPERTROPHY_VOLUME|BALANCE","NEEDS_SOURCE_TEMPLATE","heuristic_only","LOW","NO","NO","NO","NO","NO","NO","NO","NO","NO","NEEDS_TEMPLATE_DEFINITION","The proposed review family has no approved family template.","DEFINE_AND_REVIEW_FAMILY_TEMPLATE","Draft only; do not mutate seed without human approval. Subtype intentionally left for review; no broad exercise-name parsing was used. No approved family template; concrete muscle values were not invented.","NO","ANATOMY_SUPPORTED_TEMPLATE","Approved reusable template CHEST_ISOLATION was applied. Source verification remains separate and unresolved.","NONE","SOURCE_ONLY","ACCEPT_SOURCE_POLICY_DRAFT_ONLY","READY_AFTER_SOURCE_VERIFICATION","TEMPLATE_DEFINITION_REQUIRED","CHEST_ISOLATION","CHEST_ISOLATION","","CHEST_ISOLATION_ACCESSORY","CHEST_FLY_ISOLATION","LOAD_REPS","CHEST_FLY_ISOLATION","HYPERTROPHY_VOLUME/FATIGUE","","","","","","","","","","","","","","","TEMPLATE","SOURCE_ACCEPTED_DRAFT_ONLY","Approved reusable template CHEST_ISOLATION was applied.","ANATOMY_SUPPORTED","ACCEPT_ANATOMY_SUPPORTED","The ordinary movement and muscle classification is anatomically stable despite the missing exercise-specific source template.","Acceptance is limited to conventional family, muscle, slot, and volume metadata.","NO","NONE","SOURCE_ACCEPTED","SOURCE_VERIFICATION_ONLY"
"크로스바디 해머 컬","ex_b69ab702","category=근력운동; movement_category=ACCESSORY; force_type=ISOLATION; movement_pattern=ELBOW_FLEXION|BICEPS_ACCESSORY|FOREARM_GRIP_SUPPORT|BRACHIALIS_BRACHIORADIALIS","ELBOW_FLEXION|BICEPS_ACCESSORY|FOREARM_GRIP_SUPPORT|BRACHIALIS_BRACHIORADIALIS","ACCESSORY","ISOLATION","EXERCISE","NOT_PRESENT_IN_SEED","ELBOW_FLEXION_BRACHIALIS_BRACHIORADIALIS_VARIANTS","CROSS_BODY_HAMMER_CURL","BRACHIALIS|BRACHIORADIALIS|BICEPS_BRACHII|FOREARM_EXTENSORS|FOREARM_FLEXORS|GRIP_FLEXORS|DEEP_CORE","{""BRACHIALIS"":0.28,""BRACHIORADIALIS"":0.25,""BICEPS_BRACHII"":0.18,""FOREARM_EXTENSORS"":0.10,""FOREARM_FLEXORS"":0.08,""GRIP_FLEXORS"":0.07,""DEEP_CORE"":0.04}","BRACHIALIS_FOREARM_ACCESSORY","ELBOW_FLEXION_NEUTRAL_PRONATED_CURL","VOLUME_LOAD","LOCAL_MUSCLE|ELBOW_FLEXION|GRIP_FOREARM_MODERATE|LOW_SYSTEMIC","NONE","GRIP_FOREARM_SUPPORT","FATIGUE|HYPERTROPHY_VOLUME|BADMINTON_TRANSFER|BALANCE","A_OPENSTAX_11_5|E_BADMINTON_INJURY_PMC7205924","anatomy_textbook","MEDIUM","NO","NO","NO","NO","NO","NO","YES","YES","NO","NEEDS_SOURCE_REVIEW","Neutral/pronated curl family is corrected; support source still needs review.","VERIFY_EXISTING_SOURCE_IDS","V2 taxonomy correction draft only. Muscle contribution is an app-internal heuristic, not a physiological measurement. Do not mutate seed without human approval.","NO","ANATOMY_SUPPORTED_TEMPLATE","운동 family와 program slot은 통상적 분류로 안정적이며, 남은 작업은 evidence source ID 확인입니다.","NONE","SOURCE_ONLY","ACCEPT_SOURCE_POLICY_DRAFT_ONLY","READY_AFTER_SOURCE_VERIFICATION","SOURCE_VERIFICATION_ONLY","","ELBOW_FLEXION_BRACHIALIS_BRACHIORADIALIS_VARIANTS","CROSS_BODY_HAMMER_CURL","BRACHIALIS_FOREARM_ACCESSORY","ELBOW_FLEXION_NEUTRAL_PRONATED_CURL","VOLUME_LOAD","","FATIGUE|HYPERTROPHY_VOLUME|BADMINTON_TRANSFER|BALANCE","","","","","","","","","","","","","","","","SOURCE_ACCEPTED_DRAFT_ONLY","","ANATOMY_SUPPORTED","ACCEPT_ANATOMY_SUPPORTED","The movement family, primary muscles, and program role are anatomically stable and conventional.","The badminton injury source is contextual only; anatomy support, not that injury source, carries the ordinary exercise classification.","NO","NONE","SOURCE_ACCEPTED","SOURCE_VERIFICATION_ONLY"
"클로즈그립 벤치프레스","ex_27b3deb5","category=근력운동; movement_category=STRENGTH; force_type=PUSH; movement_pattern=PUSH_HORIZONTAL|CHEST_STRENGTH","PUSH_HORIZONTAL|CHEST_STRENGTH","STRENGTH","PUSH","EXERCISE","NOT_PRESENT_IN_SEED","BENCH_PRESS_DUMBBELL_PRESS_MACHINE_PRESS_VARIANTS","CLOSE_GRIP_BENCH_PRESS_TRICEPS_EMPHASIS","PECTORALIS_MAJOR_STERNAL|PECTORALIS_MAJOR_CLAVICULAR|ANTERIOR_DELTOID|TRICEPS_BRACHII|SERRATUS_ANTERIOR|ROTATOR_CUFF_EXTERNAL|ROTATOR_CUFF_INTERNAL|DEEP_CORE","{""PECTORALIS_MAJOR_STERNAL"":0.3,""PECTORALIS_MAJOR_CLAVICULAR"":0.15,""ANTERIOR_DELTOID"":0.2,""TRICEPS_BRACHII"":0.2,""SERRATUS_ANTERIOR"":0.05,""ROTATOR_CUFF_EXTERNAL"":0.05,""DEEP_CORE"":0.05}","TRICEPS_EMPHASIS_COMPOUND_PUSH","CLOSE_GRIP_BENCH_TRICEPS_PUSH","VOLUME_LOAD","LOCAL_MUSCLE/TRICEPS_EMPHASIS/UPPER_PUSH_COMPOUND","NONE","UPPER_PUSH_CAPACITY/TRICEPS_SUPPORT","FATIGUE|STRENGTH_PROGRESS|HYPERTROPHY_VOLUME|BALANCE","A_OPENSTAX_11_5|C_BENCH_INCLINE_EMG_PMC7579505|B_ACSM_2009_PMID19204579","anatomy_textbook","HIGH","NO","NO","NO","NO","NO","NO","NO","YES","NO","READY_TEMPLATE_CANDIDATE","USER_JUDGEMENT_APPLIED","KEEP_DRAFT_ONLY_FOR_FUTURE_SEED_REVIEW","Draft only; do not mutate seed without human approval. Muscle contribution is an app-internal heuristic, not a physiological measurement. Subtype intentionally left for review; no broad exercise-name parsing was used. | USER_JUDGEMENT_APPLIED_2026-06-18","CANDIDATE_AFTER_ROW_REVIEW","ANATOMY_SUPPORTED_TEMPLATE","User resolved the family/subtype decision and the resulting template is anatomy-supported for app-internal use.","NONE","NONE","ACCEPT_AS_ANATOMY_SUPPORTED","NOT_READY","ANATOMY_SUPPORTED_TEMPLATE","","BENCH_PRESS_DUMBBELL_PRESS_MACHINE_PRESS_VARIANTS","CLOSE_GRIP_BENCH_PRESS_TRICEPS_EMPHASIS","TRICEPS_EMPHASIS_COMPOUND_PUSH","CLOSE_GRIP_BENCH_TRICEPS_PUSH","VOLUME_LOAD","","FATIGUE|STRENGTH_PROGRESS|HYPERTROPHY_VOLUME|BALANCE","","","","","","","","","","","","","","","","NOT_IN_DECISION_PACK_SCOPE","","","","","","","","",""
