"스쿼트","barbell_back_squat","category=근력운동; movement_category=STRENGTH; force_type=LOWER_BODY; movement_pattern=KNEE_DOMINANT|LOWER_BODY_STRENGTH|SQUAT_PATTERN","KNEE_DOMINANT|LOWER_BODY_STRENGTH|SQUAT_PATTERN","STRENGTH","LOWER_BODY","EXERCISE","NOT_PRESENT_IN_SEED","SQUAT_VARIANTS","BACK_SQUAT","QUADRICEPS|RECTUS_FEMORIS|GLUTE_MAX|HAMSTRINGS|ERECTOR_SPINAE|GLUTE_MED_MIN|DEEP_CORE|OBLIQUES|HIP_ADDUCTORS","{""QUADRICEPS"":0.3,""RECTUS_FEMORIS"":0.1,""GLUTE_MAX"":0.25,""HAMSTRINGS"":0.08,""ERECTOR_SPINAE"":0.1,""DEEP_CORE"":0.07,""GLUTE_MED_MIN"":0.05,""HIP_ADDUCTORS"":0.05}","MAIN_LOWER_STRENGTH","SQUAT_PATTERN_HEAVY_LOWER","ESTIMATED_1RM","SYSTEMIC|NEURAL_HEAVY|LOCAL_MUSCLE|HIGH|MODERATE_AXIAL_LOAD","NONE","LOWER_STRENGTH_SUPPORT|KNEE_CONTROL|HIP_STABILITY_SUPPORT","FATIGUE|STRENGTH_PROGRESS|HYPERTROPHY_VOLUME|BALANCE","A_OPENSTAX_11_6|B_ACSM_2009_PMID19204579|B_NSCA_ESSENTIALS_5E|C_GLUTE_MAX_REVIEW_PMC7039033","governing_body_resource","LOW","NO","NO","NO","NO","NO","NO","NO","PARTIAL","NO","NEEDS_STRESS_REVIEW","Axial, plyometric, deceleration, SSC, or session stress mapping needs review.","REVIEW_STRESS_AND_RECOVERY_MAPPING","Draft only; do not mutate seed without human approval. Muscle contribution is an app-internal heuristic, not a physiological measurement.","CANDIDATE_AFTER_STRESS_REVIEW","ACCEPTED_HEURISTIC","Approved compressed stress profile HEAVY_AXIAL_LOWER_STRESS was applied with separate detail tags.","NONE","NONE","KEEP_DRAFT_ONLY_FOR_FINAL_SEED_APPROVAL","READY_AFTER_STRESS_REVIEW","STRESS_REVIEW_REQUIRED","","SQUAT_VARIANTS","BACK_SQUAT","MAIN_LOWER_STRENGTH","SQUAT_PATTERN_HEAVY_LOWER","ESTIMATED_1RM","","FATIGUE|STRENGTH_PROGRESS|HYPERTROPHY_VOLUME|BALANCE","HEAVY_AXIAL_LOWER_STRESS","QUAD_LOAD/GLUTE_LOAD/HAMSTRING_LOAD/BARBELL_LOAD/HEAVY_LOAD/NEURAL_LOAD/CORE_BRACING_LOAD","PATELLAR_TENDON_STRESS","KNEE_VALGUS_CONTROL_STRESS/KNEE_ROTATIONAL_STABILITY_STRESS/LUMBOPELVIC_CONTROL_STRESS","NONE","NONE","NONE","VERY_LONG","VERY_HIGH","","","","","","STRESS","READY_AFTER_DECISION_PACK","Approved compressed stress profile HEAVY_AXIAL_LOWER_STRESS was applied with separate detail tags.","","","","","","","",""
"스탠딩 레그 컬","ex_b59bed7d","category=근력운동; movement_category=ACCESSORY; force_type=ISOLATION; movement_pattern=KNEE_FLEXION|HAMSTRING_STRENGTH","KNEE_FLEXION|HAMSTRING_STRENGTH","ACCESSORY","ISOLATION","EXERCISE","NOT_PRESENT_IN_SEED","HAMSTRING_CURL_VARIANTS","NEEDS_SUBTYPE_REVIEW","HAMSTRINGS|GASTROCNEMIUS|GLUTE_MAX|GLUTE_MED_MIN|DEEP_CORE","{""HAMSTRINGS"":0.65,""GASTROCNEMIUS"":0.1,""GLUTE_MAX"":0.05,""GLUTE_MED_MIN"":0.08,""DEEP_CORE"":0.07,""HIP_ADDUCTORS"":0.05}","POSTERIOR_CHAIN_ACCESSORY","HAMSTRING_KNEE_FLEXION","VOLUME_LOAD","LOCAL_MUSCLE|SHORT_TO_MEDIUM_DECAY","NONE","POSTERIOR_CHAIN_CAPACITY","FATIGUE|HYPERTROPHY_VOLUME","A_OPENSTAX_11_6|B_ACSM_2009_PMID19204579","anatomy_textbook","HIGH","NO","YES","NO","NO","NO","NO","NO","PARTIAL","NO","NEEDS_ROW_REVIEW","Cleanup demotion: READY_TEMPLATE_CANDIDATE requires resolved subtype, no REVIEW fields, no unresolved review flags, and template-safe defaults.","RESOLVE_READY_CLEANUP_VIOLATIONS","Draft only; do not mutate seed without human approval. Muscle contribution is an app-internal heuristic, not a physiological measurement. Subtype intentionally left for review; no broad exercise-name parsing was used.","CANDIDATE_AFTER_ROW_REVIEW","ANATOMY_SUPPORTED_TEMPLATE","Approved reusable template HAMSTRING_CURL_VARIANTS was applied.","NONE","NONE","KEEP_DRAFT_ONLY_FOR_FINAL_SEED_APPROVAL","READY_AFTER_TEMPLATE_DEFINITION","TEMPLATE_DEFINITION_REQUIRED","HAMSTRING_CURL_VARIANTS","HAMSTRING_CURL_VARIANTS","","HAMSTRING_ISOLATION_ACCESSORY","HAMSTRING_KNEE_FLEXION_ISOLATION","LOAD_REPS","HAMSTRING_KNEE_FLEXION_ISOLATION","HYPERTROPHY_VOLUME/FATIGUE","","","","","","","","","","","","","","","TEMPLATE","READY_AFTER_DECISION_PACK","Approved reusable template HAMSTRING_CURL_VARIANTS was applied.","","","","","","","",""
"스탠딩 카프 레이즈","ex_bd072cd","category=근력운동; movement_category=ACCESSORY; force_type=ISOLATION; movement_pattern=CALF_ANKLE_STRENGTH|ANKLE_STIFFNESS_SUPPORT","CALF_ANKLE_STRENGTH|ANKLE_STIFFNESS_SUPPORT","ACCESSORY","ISOLATION","EXERCISE","NOT_PRESENT_IN_SEED","CALF_RAISE_ANKLE_STIFFNESS_VARIANTS","NEEDS_SUBTYPE_REVIEW","GASTROCNEMIUS|SOLEUS|TIBIALIS_ANTERIOR|DEEP_CORE","{""GASTROCNEMIUS"":0.35,""SOLEUS"":0.3,""TIBIALIS_ANTERIOR"":0.1,""DEEP_CORE"":0.05,""GLUTE_MED_MIN"":0.05,""QUADRICEPS"":0.05,""HAMSTRINGS"":0.05,""HIP_ADDUCTORS"":0.05}","ANKLE_CALF_SUPPORT","CALF_ACHILLES_ANKLE_STIFFNESS","VOLUME_LOAD","LOCAL_MUSCLE|ELASTIC_SSC_REVIEW","NONE","ANKLE_SSC_SUPPORT|LANDING_SUPPORT","FATIGUE|HYPERTROPHY_VOLUME|BADMINTON_TRANSFER_REVIEW|BALANCE","A_OPENSTAX_11_6|E_BADMINTON_LUNGE_PMC7648456","anatomy_textbook","MEDIUM","NO","NO","NO","NO","NO","NO","YES","YES","NO","NEEDS_SOURCE_REVIEW","Family is usable as a draft, but evidence source verification remains.","VERIFY_EXISTING_SOURCE_IDS","Draft only; do not mutate seed without human approval. Muscle contribution is an app-internal heuristic, not a physiological measurement. Subtype intentionally left for review; no broad exercise-name parsing was used. Sources need network recheck: E_BADMINTON_LUNGE_PMC7648456","NO","ANATOMY_SUPPORTED_TEMPLATE","Approved compressed stress profile ISOLATION_ACCESSORY_STRESS was applied with separate detail tags. Source verification remains separate and unresolved.","NONE","SOURCE_ONLY","ACCEPT_SOURCE_POLICY_DRAFT_ONLY","READY_AFTER_SOURCE_VERIFICATION","STRESS_REVIEW_REQUIRED","","CALF_RAISE_ANKLE_STIFFNESS_VARIANTS","NEEDS_SUBTYPE_REVIEW","ANKLE_CALF_SUPPORT","CALF_ACHILLES_ANKLE_STIFFNESS","VOLUME_LOAD","","FATIGUE|HYPERTROPHY_VOLUME|BADMINTON_TRANSFER_REVIEW|BALANCE","ISOLATION_ACCESSORY_STRESS","CALF_ANKLE_SSC_LOAD","ACHILLES_TENDON_STRESS","ANKLE_EVERSION_CONTROL_STRESS","NONE","NONE","NONE","SHORT","MODERATE","","","","","","STRESS","SOURCE_ACCEPTED_DRAFT_ONLY","Approved compressed stress profile ISOLATION_ACCESSORY_STRESS was applied with separate detail tags.","ANATOMY_SUPPORTED","ACCEPT_ANATOMY_SUPPORTED","The movement family, primary muscles, and program role are anatomically stable and conventional.","Anatomy support is sufficient for conventional app-internal classification; exact variant evidence is not claimed.","NO","NONE","SOURCE_ACCEPTED","SOURCE_VERIFICATION_ONLY"
"스트레이트암 풀다운","ex_ca5cce66","category=근력운동; movement_category=ACCESSORY; force_type=PULL; movement_pattern=SHOULDER_EXTENSION|LAT_ACCESSORY|SCAPULAR_CONTROL","SHOULDER_EXTENSION|LAT_ACCESSORY|SCAPULAR_CONTROL","ACCESSORY","PULL","EXERCISE","NOT_PRESENT_IN_SEED","LAT_STRAIGHT_ARM_PULLDOWN_OR_PULLOVER_ACCESSORY_REVIEW","STRAIGHT_ARM_PULLDOWN","REVIEW","REVIEW","REVIEW","REVIEW","REVIEW","REVIEW","REVIEW","REVIEW","REVIEW","NEEDS_SOURCE_TEMPLATE","heuristic_only","NEEDS_REVIEW","NO","YES","NO","NO","NO","NO","NO","NO","NO","NEEDS_ROW_REVIEW","Row family or subtype requires explicit human judgement before mutation.","CONFIRM_FAMILY_AND_SUBTYPE","Draft only; do not mutate seed without human approval. No approved family template; concrete muscle values were not invented.","NO","ANATOMY_SUPPORTED_TEMPLATE","The approved template resolves classification; evidence source verification remains separate.","NONE","SOURCE_ONLY","ACCEPT_SOURCE_POLICY_DRAFT_ONLY","READY_AFTER_SOURCE_VERIFICATION","TEMPLATE_DEFINITION_REQUIRED","LAT_STRAIGHT_ARM_PULLDOWN_ACCESSORY","LAT_STRAIGHT_ARM_PULLDOWN_OR_PULLOVER_ACCESSORY","STRAIGHT_ARM_PULLDOWN","LAT_ACCESSORY","STRAIGHT_ARM_LAT_ACCESSORY","LOAD_REPS","STRAIGHT_ARM_LAT_ACCESSORY","HYPERTROPHY_VOLUME | FATIGUE","","","","","","","","","","","","","","","TEMPLATE_GAP","SOURCE_ACCEPTED_DRAFT_ONLY","Approved template applied; source verification was not performed.","ANATOMY_SUPPORTED","ACCEPT_ANATOMY_SUPPORTED","The ordinary movement and muscle classification is anatomically stable despite the missing exercise-specific source template.","Acceptance is limited to conventional family, muscle, slot, and volume metadata.","NO","NONE","SOURCE_ACCEPTED","SOURCE_VERIFICATION_ONLY"
"스파이더 컬","ex_516f4456","category=근력운동; movement_category=ACCESSORY; force_type=ISOLATION; movement_pattern=ELBOW_FLEXION|BICEPS_ACCESSORY|FOREARM_GRIP_SUPPORT|BICEPS_ISOLATION_STRICT","ELBOW_FLEXION|BICEPS_ACCESSORY|FOREARM_GRIP_SUPPORT|BICEPS_ISOLATION_STRICT","ACCESSORY","ISOLATION","EXERCISE","NOT_PRESENT_IN_SEED","ELBOW_FLEXION_BICEPS_CURL_VARIANTS","SPIDER_CURL","BICEPS_BRACHII|BRACHIALIS|BRACHIORADIALIS|FOREARM_FLEXORS|GRIP_FLEXORS|DEEP_CORE","{""BICEPS_BRACHII"":0.45,""BRACHIALIS"":0.18,""BRACHIORADIALIS"":0.12,""FOREARM_FLEXORS"":0.10,""GRIP_FLEXORS"":0.08,""DEEP_CORE"":0.07}","BICEPS_ACCESSORY","ELBOW_FLEXION_CURL","VOLUME_LOAD","LOCAL_MUSCLE|ELBOW_FLEXION|GRIP_FOREARM_LOW_TO_MODERATE|LOW_SYSTEMIC","NONE","GRIP_FOREARM_SUPPORT_WHEN_MEANINGFUL","FATIGUE|HYPERTROPHY_VOLUME|BADMINTON_TRANSFER|BALANCE","A_OPENSTAX_11_5|E_BADMINTON_INJURY_PMC7205924","anatomy_textbook","MEDIUM","NO","NO","NO","NO","NO","NO","NO","YES","NO","NEEDS_SOURCE_REVIEW","Arm family is corrected; badminton-support source still needs network recheck.","VERIFY_EXISTING_SOURCE_IDS","V2 taxonomy correction draft only. Muscle contribution is an app-internal heuristic, not a physiological measurement. Do not mutate seed without human approval.","NO","ANATOMY_SUPPORTED_TEMPLATE","운동 family와 program slot은 통상적 분류로 안정적이며, 남은 작업은 evidence source ID 확인입니다.","NONE","SOURCE_ONLY","ACCEPT_SOURCE_POLICY_DRAFT_ONLY","READY_AFTER_SOURCE_VERIFICATION","SOURCE_VERIFICATION_ONLY","","ELBOW_FLEXION_BICEPS_CURL_VARIANTS","SPIDER_CURL","BICEPS_ACCESSORY","ELBOW_FLEXION_CURL","VOLUME_LOAD","","FATIGUE|HYPERTROPHY_VOLUME|BADMINTON_TRANSFER|BALANCE","","","","","","","","","","","","","","","","SOURCE_ACCEPTED_DRAFT_ONLY","","ANATOMY_SUPPORTED","ACCEPT_ANATOMY_SUPPORTED","The movement family, primary muscles, and program role are anatomically stable and conventional.","The badminton injury source is contextual only; anatomy support, not that injury source, carries the ordinary exercise classification.","NO","NONE","SOURCE_ACCEPTED","SOURCE_VERIFICATION_ONLY"
"스플릿 스쿼트","ex_f2a79d37","category=근력운동; movement_category=STRENGTH; force_type=LOWER_BODY; movement_pattern=KNEE_DOMINANT|LOWER_BODY_STRENGTH|SQUAT_PATTERN|UNILATERAL_LOWER|HIP_STABILITY_SUPPORT","KNEE_DOMINANT|LOWER_BODY_STRENGTH|SQUAT_PATTERN|UNILATERAL_LOWER|HIP_STABILITY_SUPPORT","STRENGTH","LOWER_BODY","EXERCISE","NOT_PRESENT_IN_SEED","LUNGE_SPLIT_SQUAT_VARIANTS","NEEDS_SUBTYPE_REVIEW","QUADRICEPS|RECTUS_FEMORIS|GLUTE_MAX|HAMSTRINGS|HIP_ADDUCTORS|GASTROCNEMIUS|SOLEUS|GLUTE_MED_MIN|DEEP_CORE|OBLIQUES|TIBIALIS_ANTERIOR","{""QUADRICEPS"":0.25,""RECTUS_FEMORIS"":0.1,""GLUTE_MAX"":0.25,""HAMSTRINGS"":0.1,""HIP_ADDUCTORS"":0.08,""GASTROCNEMIUS"":0.05,""SOLEUS"":0.05,""GLUTE_MED_MIN"":0.05,""DEEP_CORE"":0.04,""OBLIQUES"":0.03}","UNILATERAL_LOWER_STRENGTH","LUNGE_UNILATERAL_LOWER","VOLUME_LOAD","LOCAL_MUSCLE|SYSTEMIC_MODERATE|DECELERATION_REVIEW","LUNGE_REACH_REVIEW","HIP_STABILITY_SUPPORT|KNEE_CONTROL","FATIGUE|HYPERTROPHY_VOLUME|BADMINTON_TRANSFER_REVIEW|BALANCE","A_OPENSTAX_11_6|E_BADMINTON_LUNGE_PMC7648456|C_GLUTE_MED_MIN_META_PMC7727410","anatomy_textbook","MEDIUM","NO","NO","NO","NO","NO","NO","YES","YES","NO","NEEDS_SOURCE_REVIEW","Family is usable as a draft, but evidence source verification remains.","VERIFY_EXISTING_SOURCE_IDS","Draft only; do not mutate seed without human approval. Muscle contribution is an app-internal heuristic, not a physiological measurement. Subtype intentionally left for review; no broad exercise-name parsing was used. Sources need network recheck: E_BADMINTON_LUNGE_PMC7648456|C_GLUTE_MED_MIN_META_PMC7727410","NO","ANATOMY_SUPPORTED_TEMPLATE","Approved compressed stress profile UNILATERAL_LOWER_STABILITY_STRESS was applied with separate detail tags. Source verification remains separate and unresolved.","NONE","SOURCE_ONLY","ACCEPT_SOURCE_POLICY_DRAFT_ONLY","READY_AFTER_SOURCE_VERIFICATION","STRESS_REVIEW_REQUIRED","","LUNGE_SPLIT_SQUAT_VARIANTS","NEEDS_SUBTYPE_REVIEW","UNILATERAL_LOWER_STRENGTH","LUNGE_UNILATERAL_LOWER","VOLUME_LOAD","","FATIGUE|HYPERTROPHY_VOLUME|BADMINTON_TRANSFER_REVIEW|BALANCE","UNILATERAL_LOWER_STABILITY_STRESS","QUAD_LOAD/GLUTE_LOAD/UNILATERAL_CONTROL_LOAD/SINGLE_LEG_STABILITY_LOAD/HIP_CONTROL_LOAD","PATELLAR_TENDON_STRESS","KNEE_VALGUS_CONTROL_STRESS/HIP_ROTATIONAL_CONTROL_STRESS/LUMBOPELVIC_CONTROL_STRESS","NONE","NONE","NONE","MEDIUM","MODERATE","","","","","","STRESS","SOURCE_ACCEPTED_DRAFT_ONLY","Approved compressed stress profile UNILATERAL_LOWER_STABILITY_STRESS was applied with separate detail tags.","VERIFIED_FAMILY","ACCEPT_VERIFIED_FAMILY","The existing source group supports the movement or sport family at family level.","Acceptance does not claim that every equipment or stance variant was studied directly.","NO","NONE","SOURCE_ACCEPTED","SOURCE_VERIFICATION_ONLY"
"시티드 원암 케이블 로우","ex_a76f20b6","category=근력운동; movement_category=STRENGTH; force_type=PULL; movement_pattern=PULL_HORIZONTAL|BACK_STRENGTH|SCAPULAR_RETRACTION|UNILATERAL_UPPER","PULL_HORIZONTAL|BACK_STRENGTH|SCAPULAR_RETRACTION|UNILATERAL_UPPER","STRENGTH","PULL","EXERCISE","NOT_PRESENT_IN_SEED","ROW_VARIANTS","NEEDS_SUBTYPE_REVIEW","LATISSIMUS_DORSI|RHOMBOIDS|TRAPEZIUS_MIDDLE|POSTERIOR_DELTOID|BICEPS_BRACHII|BRACHIALIS|BRACHIORADIALIS|TRAPEZIUS_LOWER|ROTATOR_CUFF_EXTERNAL|GRIP_FLEXORS|DEEP_CORE|OBLIQUES","{""LATISSIMUS_DORSI"":0.25,""RHOMBOIDS"":0.15,""TRAPEZIUS_MIDDLE"":0.15,""POSTERIOR_DELTOID"":0.12,""BICEPS_BRACHII"":0.1,""BRACHIALIS"":0.05,""BRACHIORADIALIS"":0.04,""GRIP_FLEXORS"":0.05,""TRAPEZIUS_LOWER"":0.04,""DEEP_CORE"":0.03,""OBLIQUES"":0.02}","HORIZONTAL_PULL_STRENGTH","HORIZONTAL_PULL_COMPOUND","VOLUME_LOAD","LOCAL_MUSCLE|NEURAL_HEAVY_MODERATE_REVIEW|GRIP_FOREARM|ANTI_ROTATION_UNILATERAL_REVIEW","NONE","SHOULDER_DURABILITY|ANTI_ROTATION_STABILITY|GRIP_FOREARM","FATIGUE|STRENGTH_PROGRESS|HYPERTROPHY_VOLUME|BADMINTON_TRANSFER|BALANCE","A_OPENSTAX_11_5","anatomy_textbook","NEEDS_REVIEW","NO","YES","NO","NO","NO","NO","NO","PARTIAL","NO","NEEDS_ROW_REVIEW","Row family or subtype requires explicit human judgement before mutation.","CONFIRM_FAMILY_AND_SUBTYPE","Draft only; do not mutate seed without human approval. Muscle contribution is an app-internal heuristic, not a physiological measurement. Subtype intentionally left for review; no broad exercise-name parsing was used. Inverted-row evidence is retained, but non-inverted row subtype needs manual source review. Sources need network recheck: D_SCAP_ROTATOR_CUFF_PMC2857390","NO","ACCEPTED_HEURISTIC","Approved compressed stress profile HORIZONTAL_ROW_STRESS was applied with separate detail tags. Source verification remains separate and unresolved.","NONE","SOURCE_ONLY","ACCEPT_WITH_DOCUMENTED_SOURCE_LIMITATION","READY_AFTER_SOURCE_VERIFICATION","STRESS_REVIEW_REQUIRED","","ROW_VARIANTS","NEEDS_SUBTYPE_REVIEW","HORIZONTAL_PULL_STRENGTH","HORIZONTAL_PULL_COMPOUND","VOLUME_LOAD","","FATIGUE|STRENGTH_PROGRESS|HYPERTROPHY_VOLUME|BADMINTON_TRANSFER|BALANCE","HORIZONTAL_ROW_STRESS","LAT_LOAD/UPPER_BACK_LOAD/REAR_DELTOID_LOAD/BICEPS_LOAD/GRIP_LOAD/SCAPULAR_STABILITY_LOAD","BICEPS_TENDON_STRESS/FOREARM_FLEXOR_TENDON_STRESS","SHOULDER_JOINT_STABILITY_STRESS/ELBOW_JOINT_STRESS","NONE","NONE","NONE","MEDIUM","MODERATE","","","","","","STRESS","SOURCE_ACCEPTED_WITH_LIMITATION_DRAFT_ONLY","Approved compressed stress profile HORIZONTAL_ROW_STRESS was applied with separate detail tags.","SOURCE_WEAK_BUT_ACCEPTABLE","ACCEPT_WEAK_SOURCE_WITH_LIMITATION","User-approved practical support closes cable row classification without subtype-specific physiology claims.","Accepted as a cable horizontal-row / cable high-row family classification. Seated-row and machine-row practical sources support broad lats, rhomboids, traps, rear-deltoid and biceps involvement, but no exact subtype EMG claim is made.","NO","NONE","SOURCE_ACCEPTED_WITH_LIMITATION","SOURCE_VERIFICATION_ONLY"
"시티드 카프 레이즈","ex_5c8751d2","category=근력운동; movement_category=ACCESSORY; force_type=ISOLATION; movement_pattern=CALF_ANKLE_STRENGTH|ANKLE_STIFFNESS_SUPPORT","CALF_ANKLE_STRENGTH|ANKLE_STIFFNESS_SUPPORT","ACCESSORY","ISOLATION","EXERCISE","NOT_PRESENT_IN_SEED","CALF_RAISE_ANKLE_STIFFNESS_VARIANTS","NEEDS_SUBTYPE_REVIEW","GASTROCNEMIUS|SOLEUS|TIBIALIS_ANTERIOR|DEEP_CORE","{""GASTROCNEMIUS"":0.35,""SOLEUS"":0.3,""TIBIALIS_ANTERIOR"":0.1,""DEEP_CORE"":0.05,""GLUTE_MED_MIN"":0.05,""QUADRICEPS"":0.05,""HAMSTRINGS"":0.05,""HIP_ADDUCTORS"":0.05}","ANKLE_CALF_SUPPORT","CALF_ACHILLES_ANKLE_STIFFNESS","VOLUME_LOAD","LOCAL_MUSCLE|ELASTIC_SSC_REVIEW","NONE","ANKLE_SSC_SUPPORT|LANDING_SUPPORT","FATIGUE|HYPERTROPHY_VOLUME|BADMINTON_TRANSFER_REVIEW|BALANCE","A_OPENSTAX_11_6|E_BADMINTON_LUNGE_PMC7648456","anatomy_textbook","MEDIUM","NO","NO","NO","NO","NO","NO","YES","YES","NO","NEEDS_SOURCE_REVIEW","Family is usable as a draft, but evidence source verification remains.","VERIFY_EXISTING_SOURCE_IDS","Draft only; do not mutate seed without human approval. Muscle contribution is an app-internal heuristic, not a physiological measurement. Subtype intentionally left for review; no broad exercise-name parsing was used. Sources need network recheck: E_BADMINTON_LUNGE_PMC7648456","NO","ANATOMY_SUPPORTED_TEMPLATE","Approved compressed stress profile ISOLATION_ACCESSORY_STRESS was applied with separate detail tags. Source verification remains separate and unresolved.","NONE","SOURCE_ONLY","ACCEPT_SOURCE_POLICY_DRAFT_ONLY","READY_AFTER_SOURCE_VERIFICATION","STRESS_REVIEW_REQUIRED","","CALF_RAISE_ANKLE_STIFFNESS_VARIANTS","NEEDS_SUBTYPE_REVIEW","ANKLE_CALF_SUPPORT","CALF_ACHILLES_ANKLE_STIFFNESS","VOLUME_LOAD","","FATIGUE|HYPERTROPHY_VOLUME|BADMINTON_TRANSFER_REVIEW|BALANCE","ISOLATION_ACCESSORY_STRESS","CALF_ANKLE_SSC_LOAD","ACHILLES_TENDON_STRESS","ANKLE_EVERSION_CONTROL_STRESS","NONE","NONE","NONE","SHORT","MODERATE","","","","","","STRESS","SOURCE_ACCEPTED_DRAFT_ONLY","Approved compressed stress profile ISOLATION_ACCESSORY_STRESS was applied with separate detail tags.","ANATOMY_SUPPORTED","ACCEPT_ANATOMY_SUPPORTED","The movement family, primary muscles, and program role are anatomically stable and conventional.","Anatomy support is sufficient for conventional app-internal classification; exact variant evidence is not claimed.","NO","NONE","SOURCE_ACCEPTED","SOURCE_VERIFICATION_ONLY"
"싱글 레그 글루트 브릿지","ex_5715d6ca","category=근력운동; movement_category=SUPPORT; force_type=HINGE; movement_pattern=HIP_EXTENSION|GLUTE_STRENGTH|POSTERIOR_CHAIN_ACCESSORY|PELVIC_STABILITY|UNILATERAL_LOWER","HIP_EXTENSION|GLUTE_STRENGTH|POSTERIOR_CHAIN_ACCESSORY|PELVIC_STABILITY|UNILATERAL_LOWER","SUPPORT","HINGE","EXERCISE","NOT_PRESENT_IN_SEED","HIP_THRUST_GLUTE_BRIDGE_VARIANTS","NEEDS_SUBTYPE_REVIEW","GLUTE_MAX|HAMSTRINGS|GLUTE_MED_MIN|HIP_ADDUCTORS|DEEP_CORE|OBLIQUES","{""GLUTE_MAX"":0.45,""HAMSTRINGS"":0.15,""GLUTE_MED_MIN"":0.12,""HIP_ADDUCTORS"":0.08,""DEEP_CORE"":0.1,""OBLIQUES"":0.05,""QUADRICEPS"":0.05}","GLUTE_POSTERIOR_CHAIN_ACCESSORY","HIP_THRUST_GLUTE","VOLUME_LOAD","LOCAL_MUSCLE|SYSTEMIC_MODERATE_IF_HEAVY_REVIEW|AXIAL_LOW_RELATIVE_TO_DEADLIFT_REVIEW","NONE","POSTERIOR_CHAIN_CAPACITY|HIP_STABILITY_SUPPORT","FATIGUE|HYPERTROPHY_VOLUME|BALANCE","C_HIP_THRUST_REVIEW_PMC6544005|C_GLUTE_MAX_REVIEW_PMC7039033|C_GLUTE_REHAB_EMG_PMC3201064","emg_study","MEDIUM","NO","NO","NO","NO","NO","NO","YES","YES","NO","NEEDS_SOURCE_REVIEW","Family is usable as a draft, but evidence source verification remains.","VERIFY_EXISTING_SOURCE_IDS","Draft only; do not mutate seed without human approval. Muscle contribution is an app-internal heuristic, not a physiological measurement. Subtype intentionally left for review; no broad exercise-name parsing was used. Sources need network recheck: C_GLUTE_REHAB_EMG_PMC3201064","NO","ANATOMY_SUPPORTED_TEMPLATE","Approved compressed stress profile HINGE_POSTERIOR_CHAIN_STRESS was applied with separate detail tags. Source verification remains separate and unresolved.","NONE","SOURCE_ONLY","ACCEPT_SOURCE_POLICY_DRAFT_ONLY","READY_AFTER_SOURCE_VERIFICATION","STRESS_REVIEW_REQUIRED","","HIP_THRUST_GLUTE_BRIDGE_VARIANTS","NEEDS_SUBTYPE_REVIEW","GLUTE_POSTERIOR_CHAIN_ACCESSORY","HIP_THRUST_GLUTE","VOLUME_LOAD","","FATIGUE|HYPERTROPHY_VOLUME|BALANCE","HINGE_POSTERIOR_CHAIN_STRESS","GLUTE_LOAD/HAMSTRING_LOAD/HIP_CONTROL_LOAD/CORE_BRACING_LOAD","HAMSTRING_TENDON_STRESS","HIP_ROTATIONAL_CONTROL_STRESS/LUMBOPELVIC_CONTROL_STRESS","NONE","NONE","NONE","MEDIUM","MODERATE","","","","","","STRESS","SOURCE_ACCEPTED_DRAFT_ONLY","Approved compressed stress profile HINGE_POSTERIOR_CHAIN_STRESS was applied with separate detail tags.","VERIFIED_FAMILY","ACCEPT_VERIFIED_FAMILY","The existing source group supports the movement or sport family at family level.","Acceptance does not claim that every equipment or stance variant was studied directly.","NO","NONE","SOURCE_ACCEPTED","SOURCE_VERIFICATION_ONLY"
"싱글 레그 레그 익스텐션","ex_d60745b4","category=근력운동; movement_category=ACCESSORY; force_type=ISOLATION; movement_pattern=KNEE_EXTENSION|QUAD_ISOLATION|UNILATERAL_LOWER","KNEE_EXTENSION|QUAD_ISOLATION|UNILATERAL_LOWER","ACCESSORY","ISOLATION","EXERCISE","NOT_PRESENT_IN_SEED","KNEE_EXTENSION_QUAD_ISOLATION_REVIEW","SINGLE_LEG_LEG_EXTENSION","QUADRICEPS|RECTUS_FEMORIS|DEEP_CORE","REVIEW","KNEE_EXTENSION_ACCESSORY_REVIEW","KNEE_EXTENSION_QUAD_ISOLATION_REVIEW","VOLUME_LOAD","LOCAL_MUSCLE|KNEE_EXTENSION|LOW_SYSTEMIC","NONE","KNEE_CONTROL_SUPPORT","FATIGUE|HYPERTROPHY_VOLUME|BALANCE","A_OPENSTAX_11_6","anatomy_textbook","NEEDS_REVIEW","NO","YES","NO","NO","NO","NO","NO","NO","NO","NEEDS_ROW_REVIEW","Leg extension is separated from the leg-press compound template.","DEFINE_KNEE_EXTENSION_ISOLATION_TEMPLATE","V2 taxonomy correction draft only. Muscle contribution is an app-internal heuristic, not a physiological measurement. Do not mutate seed without human approval.","CANDIDATE_AFTER_ROW_REVIEW","ANATOMY_SUPPORTED_TEMPLATE","Approved reusable template KNEE_EXTENSION_QUAD_ISOLATION was applied.","NONE","NONE","KEEP_DRAFT_ONLY_FOR_FINAL_SEED_APPROVAL","READY_AFTER_TEMPLATE_DEFINITION","TEMPLATE_DEFINITION_REQUIRED","KNEE_EXTENSION_QUAD_ISOLATION","KNEE_EXTENSION_QUAD_ISOLATION","SINGLE_LEG_LEG_EXTENSION","QUAD_ISOLATION_ACCESSORY","KNEE_EXTENSION_QUAD_ISOLATION","LOAD_REPS","KNEE_EXTENSION_QUAD_ISOLATION","HYPERTROPHY_VOLUME/FATIGUE","","","","","","","","","","","","","","","TEMPLATE","READY_AFTER_DECISION_PACK","Approved reusable template KNEE_EXTENSION_QUAD_ISOLATION was applied.","","","","","","","",""
"싱글 레그 레그 컬","ex_8824026f","category=근력운동; movement_category=ACCESSORY; force_type=ISOLATION; movement_pattern=KNEE_FLEXION|HAMSTRING_STRENGTH","KNEE_FLEXION|HAMSTRING_STRENGTH","ACCESSORY","ISOLATION","EXERCISE","NOT_PRESENT_IN_SEED","HAMSTRING_CURL_VARIANTS","NEEDS_SUBTYPE_REVIEW","HAMSTRINGS|GASTROCNEMIUS|GLUTE_MAX|GLUTE_MED_MIN|DEEP_CORE","{""HAMSTRINGS"":0.65,""GASTROCNEMIUS"":0.1,""GLUTE_MAX"":0.05,""GLUTE_MED_MIN"":0.08,""DEEP_CORE"":0.07,""HIP_ADDUCTORS"":0.05}","POSTERIOR_CHAIN_ACCESSORY","HAMSTRING_KNEE_FLEXION","VOLUME_LOAD","LOCAL_MUSCLE|SHORT_TO_MEDIUM_DECAY","NONE","POSTERIOR_CHAIN_CAPACITY","FATIGUE|HYPERTROPHY_VOLUME","A_OPENSTAX_11_6|B_ACSM_2009_PMID19204579","anatomy_textbook","HIGH","NO","YES","NO","NO","NO","NO","NO","PARTIAL","NO","NEEDS_ROW_REVIEW","Cleanup demotion: READY_TEMPLATE_CANDIDATE requires resolved subtype, no REVIEW fields, no unresolved review flags, and template-safe defaults.","RESOLVE_READY_CLEANUP_VIOLATIONS","Draft only; do not mutate seed without human approval. Muscle contribution is an app-internal heuristic, not a physiological measurement. Subtype intentionally left for review; no broad exercise-name parsing was used.","CANDIDATE_AFTER_ROW_REVIEW","ANATOMY_SUPPORTED_TEMPLATE","Approved reusable template HAMSTRING_CURL_VARIANTS was applied.","NONE","NONE","KEEP_DRAFT_ONLY_FOR_FINAL_SEED_APPROVAL","READY_AFTER_TEMPLATE_DEFINITION","TEMPLATE_DEFINITION_REQUIRED","HAMSTRING_CURL_VARIANTS","HAMSTRING_CURL_VARIANTS","","HAMSTRING_ISOLATION_ACCESSORY","HAMSTRING_KNEE_FLEXION_ISOLATION","LOAD_REPS","HAMSTRING_KNEE_FLEXION_ISOLATION","HYPERTROPHY_VOLUME/FATIGUE","","","","","","","","","","","","","","","TEMPLATE","READY_AFTER_DECISION_PACK","Approved reusable template HAMSTRING_CURL_VARIANTS was applied.","","","","","","","",""
