"exerciseName","stableKey","currentCategoryType","currentMovementPattern","currentMovementCategory","currentForceType","currentActivityKind","currentPlanningEligibility","proposedMovementFamily","proposedMovementSubtype","proposedDetailedMuscleTags","proposedMuscleContribution","proposedProgramSlot","proposedRedundancyGroup","proposedProgressMetricType","proposedFatigueProfile","proposedBadmintonTransferDirect","proposedBadmintonTransferSupportive","proposedAnalysisEligibility","proposedEvidenceSourceGroup","proposedEvidenceLevel","metadataConfidenceCandidate","sourceReviewRequired","rowManualReviewRequired","templateMissingReviewRequired","stressReviewRequired","sportSessionReviewRequired","sourceOnlyReview","overbroadManualReview","safeForTemplateDefault","safeForSeedMutation","proposalStatus","proposalReason","recommendedNextAction","notes","seedMutationPotential","reviewDebtDecision","reviewDebtReason","humanReviewQuestion","sourceReviewKind","recommendedResolution","seedPatchReadiness","previousReviewDebtDecision","templateKey","movementFamily","movementSubtype","programSlot","redundancyGroup","progressMetricType","strengthProgressionGroup","analysisEligibility","primaryStressProfile","secondaryStressTags","tendonStressTags","ligamentJointStabilityStressTags","jointImpactStressTags","cognitiveStressTags","sportContextTags","recoveryDecayProfile","stressMagnitudeHint","badmintonTransferLevel","badmintonTransferType","badmintonSkillTargets","badmintonPhysicalQualities","transferConfidence","decisionPackDomain","decisionPackStatus","decisionPackReason","sourceConfidenceLevel","sourceVerificationDecision","sourceVerificationReason","sourceLimitationNote","humanSourceReviewRequired","humanSourceReviewQuestion","finalSourceStatus","previousSourceReviewDebtDecision"
"B-스탠스 RDL","ex_201f6426","category=근력운동; movement_category=STRENGTH; force_type=HINGE; movement_pattern=HIP_HINGE|POSTERIOR_CHAIN_STRENGTH|UNILATERAL_LOWER|HIP_STABILITY_SUPPORT","HIP_HINGE|POSTERIOR_CHAIN_STRENGTH|UNILATERAL_LOWER|HIP_STABILITY_SUPPORT","STRENGTH","HINGE","EXERCISE","NOT_PRESENT_IN_SEED","DEADLIFT_HINGE_VARIANTS","B_STANCE_RDL","GLUTE_MAX|HAMSTRINGS|ERECTOR_SPINAE|LATISSIMUS_DORSI|GRIP_FLEXORS|TRAPEZIUS_MIDDLE|DEEP_CORE|GLUTE_MED_MIN|OBLIQUES|RHOMBOIDS","{""GLUTE_MAX"":0.25,""HAMSTRINGS"":0.25,""ERECTOR_SPINAE"":0.2,""LATISSIMUS_DORSI"":0.08,""GRIP_FLEXORS"":0.07,""DEEP_CORE"":0.07,""TRAPEZIUS_MIDDLE"":0.04,""GLUTE_MED_MIN"":0.04}","UNILATERAL_HINGE_ACCESSORY","SINGLE_LEG_HINGE_STABILITY","VOLUME_LOAD","LOCAL_MUSCLE|HIP_STABILITY|LOW_TO_MODERATE_SYSTEMIC","NONE","POSTERIOR_CHAIN_CAPACITY|HIP_STABILITY_SUPPORT","FATIGUE|STRENGTH_PROGRESS|HYPERTROPHY_VOLUME|BALANCE","A_OPENSTAX_11_6|C_DEADLIFT_EMG_PMC7046193|C_GLUTE_MAX_REVIEW_PMC7039033","anatomy_textbook","NEEDS_REVIEW","NO","YES","NO","NO","NO","NO","NO","PARTIAL","NO","NEEDS_ROW_REVIEW","Unilateral hinge must not inherit heavy hinge slot or redundancy.","CONFIRM_UNILATERAL_HINGE_TEMPLATE","Draft only; do not mutate seed without human approval. Muscle contribution is an app-internal heuristic, not a physiological measurement. Subtype intentionally left for review; no broad exercise-name parsing was used.","CANDIDATE_AFTER_ROW_REVIEW","ANATOMY_SUPPORTED_TEMPLATE","일반적인 근력/보조 운동으로 movement family, 주요 근육군, program slot이 해부학적·관행적으로 안정적입니다.","NONE","NONE","ACCEPT_AS_ANATOMY_SUPPORTED","NOT_READY","ANATOMY_SUPPORTED_TEMPLATE","","DEADLIFT_HINGE_VARIANTS","B_STANCE_RDL","UNILATERAL_HINGE_ACCESSORY","SINGLE_LEG_HINGE_STABILITY","VOLUME_LOAD","","FATIGUE|STRENGTH_PROGRESS|HYPERTROPHY_VOLUME|BALANCE","","","","","","","","","","","","","","","","NOT_IN_DECISION_PACK_SCOPE","","","","","","","","",""
"EZ바 컬","ex_8633d8db","category=근력운동; movement_category=ACCESSORY; force_type=ISOLATION; movement_pattern=ELBOW_FLEXION|BICEPS_ACCESSORY|FOREARM_GRIP_SUPPORT","ELBOW_FLEXION|BICEPS_ACCESSORY|FOREARM_GRIP_SUPPORT","ACCESSORY","ISOLATION","EXERCISE","NOT_PRESENT_IN_SEED","ELBOW_FLEXION_BICEPS_CURL_VARIANTS","EZ_BAR_CURL","BICEPS_BRACHII|BRACHIALIS|BRACHIORADIALIS|FOREARM_FLEXORS|GRIP_FLEXORS|DEEP_CORE","{""BICEPS_BRACHII"":0.45,""BRACHIALIS"":0.18,""BRACHIORADIALIS"":0.12,""FOREARM_FLEXORS"":0.10,""GRIP_FLEXORS"":0.08,""DEEP_CORE"":0.07}","BICEPS_ACCESSORY","ELBOW_FLEXION_CURL","VOLUME_LOAD","LOCAL_MUSCLE|ELBOW_FLEXION|GRIP_FOREARM_LOW_TO_MODERATE|LOW_SYSTEMIC","NONE","GRIP_FOREARM_SUPPORT_WHEN_MEANINGFUL","FATIGUE|HYPERTROPHY_VOLUME|BADMINTON_TRANSFER|BALANCE","A_OPENSTAX_11_5|E_BADMINTON_INJURY_PMC7205924","anatomy_textbook","MEDIUM","NO","NO","NO","NO","NO","NO","YES","YES","NO","NEEDS_SOURCE_REVIEW","Arm family is corrected; badminton-support source still needs network recheck.","VERIFY_EXISTING_SOURCE_IDS","V2 taxonomy correction draft only. Muscle contribution is an app-internal heuristic, not a physiological measurement. Do not mutate seed without human approval.","NO","ANATOMY_SUPPORTED_TEMPLATE","운동 family와 program slot은 통상적 분류로 안정적이며, 남은 작업은 evidence source ID 확인입니다.","NONE","SOURCE_ONLY","ACCEPT_SOURCE_POLICY_DRAFT_ONLY","READY_AFTER_SOURCE_VERIFICATION","SOURCE_VERIFICATION_ONLY","","ELBOW_FLEXION_BICEPS_CURL_VARIANTS","EZ_BAR_CURL","BICEPS_ACCESSORY","ELBOW_FLEXION_CURL","VOLUME_LOAD","","FATIGUE|HYPERTROPHY_VOLUME|BADMINTON_TRANSFER|BALANCE","","","","","","","","","","","","","","","","SOURCE_ACCEPTED_DRAFT_ONLY","","ANATOMY_SUPPORTED","ACCEPT_ANATOMY_SUPPORTED","The movement family, primary muscles, and program role are anatomically stable and conventional.","The badminton injury source is contextual only; anatomy support, not that injury source, carries the ordinary exercise classification.","NO","NONE","SOURCE_ACCEPTED","SOURCE_VERIFICATION_ONLY"
"V업","ex_644e0f9d","category=근력운동; movement_category=ACCESSORY; force_type=CORE; movement_pattern=CORE_FLEXION|ANTERIOR_CORE|HIP_FLEXOR_ACCESSORY","CORE_FLEXION|ANTERIOR_CORE|HIP_FLEXOR_ACCESSORY","ACCESSORY","CORE","EXERCISE","NOT_PRESENT_IN_SEED","CORE_FLEXION_ANTERIOR_CORE_REVIEW","V_UP","REVIEW","REVIEW","REVIEW","REVIEW","REVIEW","REVIEW","REVIEW","REVIEW","REVIEW","NEEDS_SOURCE_TEMPLATE","heuristic_only","NEEDS_REVIEW","NO","YES","NO","NO","NO","NO","NO","NO","NO","NEEDS_ROW_REVIEW","Row family or subtype requires explicit human judgement before mutation.","CONFIRM_FAMILY_AND_SUBTYPE","Draft only; do not mutate seed without human approval. No approved family template; concrete muscle values were not invented.","NO","ACCEPTED_HEURISTIC","Approved reusable template CORE_FLEXION_ANTERIOR_CORE was applied. Source verification remains separate and unresolved.","NONE","SOURCE_ONLY","ACCEPT_AS_APP_INTERNAL_HEURISTIC","READY_AFTER_SOURCE_VERIFICATION","TEMPLATE_DEFINITION_REQUIRED","CORE_FLEXION_ANTERIOR_CORE","CORE_FLEXION_ANTERIOR_CORE","V_UP","CORE_FLEXION_ACCESSORY","ANTERIOR_CORE_FLEXION","REPS_OR_TIME","ANTERIOR_CORE_FLEXION","ACCESSORY_VOLUME/FATIGUE","","","","","","","","","","","","","","","TEMPLATE","SOURCE_ACCEPTED_DRAFT_ONLY","Approved reusable template CORE_FLEXION_ANTERIOR_CORE was applied.","HEURISTIC_ACCEPTED","ACCEPT_HEURISTIC","The movement classification is suitable as an app-internal heuristic and does not require exact exercise evidence.","No exact efficacy, injury, or sport-transfer claim is inferred.","NO","NONE","SOURCE_ACCEPTED","SOURCE_VERIFICATION_ONLY"
"Yates Row","ex_8e4bf08e","category=근력운동; movement_category=STRENGTH; force_type=PULL; movement_pattern=PULL_HORIZONTAL|BACK_STRENGTH|SCAPULAR_RETRACTION","PULL_HORIZONTAL|BACK_STRENGTH|SCAPULAR_RETRACTION","STRENGTH","PULL","EXERCISE","NOT_PRESENT_IN_SEED","ROW_VARIANTS","NEEDS_SUBTYPE_REVIEW","LATISSIMUS_DORSI|RHOMBOIDS|TRAPEZIUS_MIDDLE|POSTERIOR_DELTOID|BICEPS_BRACHII|BRACHIALIS|BRACHIORADIALIS|TRAPEZIUS_LOWER|ROTATOR_CUFF_EXTERNAL|GRIP_FLEXORS|DEEP_CORE|OBLIQUES","{""LATISSIMUS_DORSI"":0.25,""RHOMBOIDS"":0.15,""TRAPEZIUS_MIDDLE"":0.15,""POSTERIOR_DELTOID"":0.12,""BICEPS_BRACHII"":0.1,""BRACHIALIS"":0.05,""BRACHIORADIALIS"":0.04,""GRIP_FLEXORS"":0.05,""TRAPEZIUS_LOWER"":0.04,""DEEP_CORE"":0.03,""OBLIQUES"":0.02}","HORIZONTAL_PULL_STRENGTH","HORIZONTAL_PULL_COMPOUND","VOLUME_LOAD","LOCAL_MUSCLE|NEURAL_HEAVY_MODERATE_REVIEW|GRIP_FOREARM|ANTI_ROTATION_UNILATERAL_REVIEW","NONE","SHOULDER_DURABILITY|ANTI_ROTATION_STABILITY|GRIP_FOREARM","FATIGUE|STRENGTH_PROGRESS|HYPERTROPHY_VOLUME|BADMINTON_TRANSFER|BALANCE","A_OPENSTAX_11_5","anatomy_textbook","NEEDS_REVIEW","NO","YES","NO","NO","NO","NO","NO","PARTIAL","NO","NEEDS_ROW_REVIEW","Row family or subtype requires explicit human judgement before mutation.","CONFIRM_FAMILY_AND_SUBTYPE","Draft only; do not mutate seed without human approval. Muscle contribution is an app-internal heuristic, not a physiological measurement. Subtype intentionally left for review; no broad exercise-name parsing was used. Inverted-row evidence is retained, but non-inverted row subtype needs manual source review. Sources need network recheck: D_SCAP_ROTATOR_CUFF_PMC2857390","NO","ACCEPTED_HEURISTIC","Approved compressed stress profile HORIZONTAL_ROW_STRESS was applied with separate detail tags. Source verification remains separate and unresolved.","NONE","SOURCE_ONLY","ACCEPT_WITH_DOCUMENTED_SOURCE_LIMITATION","READY_AFTER_SOURCE_VERIFICATION","STRESS_REVIEW_REQUIRED","","ROW_VARIANTS","NEEDS_SUBTYPE_REVIEW","HORIZONTAL_PULL_STRENGTH","HORIZONTAL_PULL_COMPOUND","VOLUME_LOAD","","FATIGUE|STRENGTH_PROGRESS|HYPERTROPHY_VOLUME|BADMINTON_TRANSFER|BALANCE","HORIZONTAL_ROW_STRESS","LAT_LOAD/UPPER_BACK_LOAD/REAR_DELTOID_LOAD/BICEPS_LOAD/GRIP_LOAD/SCAPULAR_STABILITY_LOAD","BICEPS_TENDON_STRESS/FOREARM_FLEXOR_TENDON_STRESS","SHOULDER_JOINT_STABILITY_STRESS/ELBOW_JOINT_STRESS","NONE","NONE","NONE","MEDIUM","MODERATE","","","","","","STRESS","SOURCE_ACCEPTED_WITH_LIMITATION_DRAFT_ONLY","Approved compressed stress profile HORIZONTAL_ROW_STRESS was applied with separate detail tags.","SOURCE_WEAK_BUT_ACCEPTABLE","ACCEPT_WEAK_SOURCE_WITH_LIMITATION","User-approved practical and anatomy support closes the non-inverted free-weight row family at broad metadata level.","Accepted as a non-inverted free-weight horizontal-row family classification based on practical bodybuilding/anatomy sources. Existing inverted-row evidence must not be treated as exact evidence for this subtype. Muscle contribution and subtype-specific loading remain app-internal heuristics.","NO","NONE","SOURCE_ACCEPTED_WITH_LIMITATION","SOURCE_VERIFICATION_ONLY"
"글루트 브릿지","ex_389920ab","category=근력운동; movement_category=STRENGTH; force_type=HINGE; movement_pattern=HIP_EXTENSION|GLUTE_STRENGTH|POSTERIOR_CHAIN_ACCESSORY","HIP_EXTENSION|GLUTE_STRENGTH|POSTERIOR_CHAIN_ACCESSORY","STRENGTH","HINGE","EXERCISE","NOT_PRESENT_IN_SEED","HIP_THRUST_GLUTE_BRIDGE_VARIANTS","NEEDS_SUBTYPE_REVIEW","GLUTE_MAX|HAMSTRINGS|GLUTE_MED_MIN|HIP_ADDUCTORS|DEEP_CORE|OBLIQUES","{""GLUTE_MAX"":0.45,""HAMSTRINGS"":0.15,""GLUTE_MED_MIN"":0.12,""HIP_ADDUCTORS"":0.08,""DEEP_CORE"":0.1,""OBLIQUES"":0.05,""QUADRICEPS"":0.05}","GLUTE_POSTERIOR_CHAIN_ACCESSORY","HIP_THRUST_GLUTE","VOLUME_LOAD","LOCAL_MUSCLE|SYSTEMIC_MODERATE_IF_HEAVY_REVIEW|AXIAL_LOW_RELATIVE_TO_DEADLIFT_REVIEW","NONE","POSTERIOR_CHAIN_CAPACITY|HIP_STABILITY_SUPPORT","FATIGUE|HYPERTROPHY_VOLUME|BALANCE","C_HIP_THRUST_REVIEW_PMC6544005|C_GLUTE_MAX_REVIEW_PMC7039033|C_GLUTE_REHAB_EMG_PMC3201064","emg_study","MEDIUM","NO","NO","NO","NO","NO","NO","YES","YES","NO","NEEDS_SOURCE_REVIEW","Family is usable as a draft, but evidence source verification remains.","VERIFY_EXISTING_SOURCE_IDS","Draft only; do not mutate seed without human approval. Muscle contribution is an app-internal heuristic, not a physiological measurement. Subtype intentionally left for review; no broad exercise-name parsing was used. Sources need network recheck: C_GLUTE_REHAB_EMG_PMC3201064","NO","ANATOMY_SUPPORTED_TEMPLATE","Approved compressed stress profile HINGE_POSTERIOR_CHAIN_STRESS was applied with separate detail tags. Source verification remains separate and unresolved.","NONE","SOURCE_ONLY","ACCEPT_SOURCE_POLICY_DRAFT_ONLY","READY_AFTER_SOURCE_VERIFICATION","STRESS_REVIEW_REQUIRED","","HIP_THRUST_GLUTE_BRIDGE_VARIANTS","NEEDS_SUBTYPE_REVIEW","GLUTE_POSTERIOR_CHAIN_ACCESSORY","HIP_THRUST_GLUTE","VOLUME_LOAD","","FATIGUE|HYPERTROPHY_VOLUME|BALANCE","HINGE_POSTERIOR_CHAIN_STRESS","GLUTE_LOAD/HAMSTRING_LOAD/HIP_CONTROL_LOAD/CORE_BRACING_LOAD","HAMSTRING_TENDON_STRESS","HIP_ROTATIONAL_CONTROL_STRESS/LUMBOPELVIC_CONTROL_STRESS","NONE","NONE","NONE","MEDIUM","MODERATE","","","","","","STRESS","SOURCE_ACCEPTED_DRAFT_ONLY","Approved compressed stress profile HINGE_POSTERIOR_CHAIN_STRESS was applied with separate detail tags.","VERIFIED_FAMILY","ACCEPT_VERIFIED_FAMILY","The existing source group supports the movement or sport family at family level.","Acceptance does not claim that every equipment or stance variant was studied directly.","NO","NONE","SOURCE_ACCEPTED","SOURCE_VERIFICATION_ONLY"
"네거티브 풀업","ex_e4f911bb","category=근력운동; movement_category=STRENGTH; force_type=PULL; movement_pattern=PULL_VERTICAL|BACK_STRENGTH|SCAPULAR_CONTROL|ECCENTRIC_PULLING","PULL_VERTICAL|BACK_STRENGTH|SCAPULAR_CONTROL|ECCENTRIC_PULLING","STRENGTH","PULL","EXERCISE","NOT_PRESENT_IN_SEED","PULL_UP_CHIN_UP_LAT_PULLDOWN_VARIANTS","NEEDS_SUBTYPE_REVIEW","LATISSIMUS_DORSI|TERES_MAJOR|BICEPS_BRACHII|BRACHIALIS|BRACHIORADIALIS|TRAPEZIUS_LOWER|TRAPEZIUS_MIDDLE|GRIP_FLEXORS|DEEP_CORE|ROTATOR_CUFF_EXTERNAL","{""LATISSIMUS_DORSI"":0.32,""TERES_MAJOR"":0.1,""BICEPS_BRACHII"":0.14,""BRACHIALIS"":0.07,""BRACHIORADIALIS"":0.06,""TRAPEZIUS_LOWER"":0.08,""TRAPEZIUS_MIDDLE"":0.06,""GRIP_FLEXORS"":0.08,""DEEP_CORE"":0.05,""ROTATOR_CUFF_EXTERNAL"":0.04}","VERTICAL_PULL_STRENGTH","VERTICAL_PULL_COMPOUND","VOLUME_LOAD","LOCAL_MUSCLE|NEURAL_HEAVY_REVIEW|GRIP_FOREARM","NONE","GRIP_FOREARM|SHOULDER_DURABILITY","FATIGUE|STRENGTH_PROGRESS|HYPERTROPHY_VOLUME|BADMINTON_TRANSFER|BALANCE","A_OPENSTAX_11_5|C_LAT_PULLDOWN_EMG_PMC449729|E_BADMINTON_INJURY_PMC7205924","anatomy_textbook","MEDIUM","NO","NO","NO","NO","NO","NO","YES","YES","NO","NEEDS_SOURCE_REVIEW","Family is usable as a draft, but evidence source verification remains.","VERIFY_EXISTING_SOURCE_IDS","Draft only; do not mutate seed without human approval. Muscle contribution is an app-internal heuristic, not a physiological measurement. Subtype intentionally left for review; no broad exercise-name parsing was used. Sources need network recheck: C_LAT_PULLDOWN_EMG_PMC449729|E_BADMINTON_INJURY_PMC7205924","NO","ANATOMY_SUPPORTED_TEMPLATE","Approved compressed stress profile VERTICAL_PULL_STRESS was applied with separate detail tags. Source verification remains separate and unresolved.","NONE","SOURCE_ONLY","ACCEPT_SOURCE_POLICY_DRAFT_ONLY","READY_AFTER_SOURCE_VERIFICATION","STRESS_REVIEW_REQUIRED","","PULL_UP_CHIN_UP_LAT_PULLDOWN_VARIANTS","NEEDS_SUBTYPE_REVIEW","VERTICAL_PULL_STRENGTH","VERTICAL_PULL_COMPOUND","VOLUME_LOAD","","FATIGUE|STRENGTH_PROGRESS|HYPERTROPHY_VOLUME|BADMINTON_TRANSFER|BALANCE","VERTICAL_PULL_STRESS","LAT_LOAD/BICEPS_LOAD/GRIP_LOAD/SCAPULAR_CONTROL_LOAD/CORE_BRACING_LOAD/BODYWEIGHT_LOAD","BICEPS_TENDON_STRESS/FOREARM_FLEXOR_TENDON_STRESS","SHOULDER_JOINT_STABILITY_STRESS","NONE","NONE","NONE","MEDIUM","MODERATE","","","","","","STRESS","SOURCE_ACCEPTED_DRAFT_ONLY","Approved compressed stress profile VERTICAL_PULL_STRESS was applied with separate detail tags.","VERIFIED_FAMILY","ACCEPT_VERIFIED_FAMILY","The existing source group supports the movement or sport family at family level.","Acceptance does not claim that every equipment or stance variant was studied directly.","NO","NONE","SOURCE_ACCEPTED","SOURCE_VERIFICATION_ONLY"
"다이아몬드 푸시업","ex_debf6a8b","category=근력운동; movement_category=STRENGTH; force_type=PUSH; movement_pattern=PUSH_HORIZONTAL|CHEST_STRENGTH|TRICEPS_EMPHASIS","PUSH_HORIZONTAL|CHEST_STRENGTH|TRICEPS_EMPHASIS","STRENGTH","PUSH","EXERCISE","NOT_PRESENT_IN_SEED","PUSH_UP_VARIANTS","DIAMOND_PUSH_UP","PECTORALIS_MAJOR_STERNAL|PECTORALIS_MAJOR_CLAVICULAR|ANTERIOR_DELTOID|TRICEPS_BRACHII|SERRATUS_ANTERIOR|ROTATOR_CUFF_EXTERNAL|ROTATOR_CUFF_INTERNAL|DEEP_CORE","{""PECTORALIS_MAJOR_STERNAL"":0.3,""PECTORALIS_MAJOR_CLAVICULAR"":0.15,""ANTERIOR_DELTOID"":0.2,""TRICEPS_BRACHII"":0.2,""SERRATUS_ANTERIOR"":0.05,""ROTATOR_CUFF_EXTERNAL"":0.05,""DEEP_CORE"":0.05}","UPPER_PUSH_ACCESSORY","BODYWEIGHT_HORIZONTAL_PUSH","REPS_AT_LOAD","LOCAL_MUSCLE|BODYWEIGHT_HORIZONTAL_PUSH|SHOULDER_CONTROL|DEEP_CORE","NONE","UPPER_PUSH_CAPACITY|SHOULDER_CONTROL_REVIEW","FATIGUE|STRENGTH_PROGRESS|HYPERTROPHY_VOLUME|BALANCE","A_OPENSTAX_11_5|B_ACSM_2009_PMID19204579","anatomy_textbook","NEEDS_REVIEW","NO","YES","NO","NO","NO","NO","YES","PARTIAL","NO","NEEDS_ROW_REVIEW","Push-up variants must not inherit bench-press family or READY template status.","CONFIRM_PUSH_UP_BODYWEIGHT_TEMPLATE","Draft only; do not mutate seed without human approval. Muscle contribution is an app-internal heuristic, not a physiological measurement. Subtype intentionally left for review; no broad exercise-name parsing was used. V3 correction: draft/report-only taxonomy patch; do not mutate seed without human approval.","NO","ANATOMY_SUPPORTED_TEMPLATE","운동 family와 program slot은 통상적 분류로 안정적이며, 남은 작업은 evidence source ID 확인입니다.","NONE","SOURCE_ONLY","ACCEPT_SOURCE_POLICY_DRAFT_ONLY","READY_AFTER_SOURCE_VERIFICATION","SOURCE_VERIFICATION_ONLY","","PUSH_UP_VARIANTS","DIAMOND_PUSH_UP","UPPER_PUSH_ACCESSORY","BODYWEIGHT_HORIZONTAL_PUSH","REPS_AT_LOAD","","FATIGUE|STRENGTH_PROGRESS|HYPERTROPHY_VOLUME|BALANCE","","","","","","","","","","","","","","","","SOURCE_ACCEPTED_DRAFT_ONLY","","ANATOMY_SUPPORTED","ACCEPT_ANATOMY_SUPPORTED","User-approved anatomy support closes broad bodyweight horizontal-push classification.","Accepted for broad bodyweight horizontal-push classification only. Bench/incline press evidence must not be treated as exact push-up evidence, and no exact push-up EMG or subtype-specific performance claim is made.","NO","NONE","SOURCE_ACCEPTED","SOURCE_VERIFICATION_ONLY"
"덤벨 래터럴 레이즈","ex_93538692","category=근력운동; movement_category=ACCESSORY; force_type=ISOLATION; movement_pattern=SHOULDER_ABDUCTION|SHOULDER_ISOLATION|SHOULDER_ACCESSORY","SHOULDER_ABDUCTION|SHOULDER_ISOLATION|SHOULDER_ACCESSORY","ACCESSORY","ISOLATION","EXERCISE","NOT_PRESENT_IN_SEED","LATERAL_RAISE_DELTOID_ISOLATION_VARIANTS","DUMBBELL_LATERAL_RAISE","LATERAL_DELTOID|SUPRASPINATUS|TRAPEZIUS_UPPER|SERRATUS_ANTERIOR|ROTATOR_CUFF_EXTERNAL|DEEP_CORE","{""LATERAL_DELTOID"":0.45,""SUPRASPINATUS"":0.12,""TRAPEZIUS_UPPER"":0.12,""SERRATUS_ANTERIOR"":0.10,""ROTATOR_CUFF_EXTERNAL"":0.12,""DEEP_CORE"":0.09}","SHOULDER_ACCESSORY","LATERAL_DELTOID_ISOLATION","VOLUME_LOAD","LOCAL_MUSCLE|LOW_SYSTEMIC","NONE","SHOULDER_DURABILITY_REVIEW","FATIGUE|HYPERTROPHY_VOLUME|BALANCE","A_OPENSTAX_11_5|D_SCAP_ROTATOR_CUFF_PMC2857390","anatomy_textbook","NEEDS_REVIEW","NO","YES","NO","NO","NO","NO","YES","PARTIAL","NO","NEEDS_SOURCE_REVIEW","Lateral raise is split from rear-delt horizontal abduction to avoid mixed muscle contribution.","VERIFY_LATERAL_RAISE_SOURCE_TEMPLATE","Draft only; do not mutate seed without human approval. Muscle contribution is an app-internal heuristic, not a physiological measurement. Subtype intentionally left for review; no broad exercise-name parsing was used. Sources need network recheck: D_SCAP_ROTATOR_CUFF_PMC2857390 V3 correction: draft/report-only taxonomy patch; do not mutate seed without human approval.","NO","ANATOMY_SUPPORTED_TEMPLATE","운동 family와 program slot은 통상적 분류로 안정적이며, 남은 작업은 evidence source ID 확인입니다.","NONE","SOURCE_ONLY","ACCEPT_SOURCE_POLICY_DRAFT_ONLY","READY_AFTER_SOURCE_VERIFICATION","SOURCE_VERIFICATION_ONLY","","LATERAL_RAISE_DELTOID_ISOLATION_VARIANTS","DUMBBELL_LATERAL_RAISE","SHOULDER_ACCESSORY","LATERAL_DELTOID_ISOLATION","VOLUME_LOAD","","FATIGUE|HYPERTROPHY_VOLUME|BALANCE","","","","","","","","","","","","","","","","SOURCE_ACCEPTED_DRAFT_ONLY","","VERIFIED_FAMILY","ACCEPT_VERIFIED_FAMILY","The existing source group supports the movement or sport family at family level.","Acceptance does not claim that every equipment or stance variant was studied directly.","NO","NONE","SOURCE_ACCEPTED","SOURCE_VERIFICATION_ONLY"
"덤벨 루마니안 데드리프트","ex_9523db82","category=근력운동; movement_category=STRENGTH; force_type=HINGE; movement_pattern=HIP_HINGE|POSTERIOR_CHAIN_STRENGTH","HIP_HINGE|POSTERIOR_CHAIN_STRENGTH","STRENGTH","HINGE","EXERCISE","NOT_PRESENT_IN_SEED","DEADLIFT_HINGE_VARIANTS","DUMBBELL_ROMANIAN_DEADLIFT","GLUTE_MAX|HAMSTRINGS|ERECTOR_SPINAE|LATISSIMUS_DORSI|GRIP_FLEXORS|TRAPEZIUS_MIDDLE|DEEP_CORE|GLUTE_MED_MIN|OBLIQUES|RHOMBOIDS","{""GLUTE_MAX"":0.25,""HAMSTRINGS"":0.25,""ERECTOR_SPINAE"":0.2,""LATISSIMUS_DORSI"":0.08,""GRIP_FLEXORS"":0.07,""DEEP_CORE"":0.07,""TRAPEZIUS_MIDDLE"":0.04,""GLUTE_MED_MIN"":0.04}","POSTERIOR_CHAIN_ACCESSORY","DUMBBELL_RDL_HINGE_ACCESSORY","VOLUME_LOAD","LOCAL_MUSCLE|POSTERIOR_CHAIN_ACCESSORY|GRIP_FOREARM|LOW_TO_MODERATE_SYSTEMIC","NONE","POSTERIOR_CHAIN_CAPACITY|HIP_STABILITY_SUPPORT","FATIGUE|STRENGTH_PROGRESS|HYPERTROPHY_VOLUME|BALANCE","A_OPENSTAX_11_6|C_DEADLIFT_EMG_PMC7046193|C_GLUTE_MAX_REVIEW_PMC7039033","anatomy_textbook","NEEDS_REVIEW","NO","YES","NO","NO","NO","NO","NO","PARTIAL","NO","NEEDS_STRESS_REVIEW","Dumbbell RDL must not inherit main hinge, heavy hinge, or e1RM defaults.","REVIEW_DUMBBELL_RDL_STRESS_AND_PROGRESS_METRIC","Draft only; do not mutate seed without human approval. Muscle contribution is an app-internal heuristic, not a physiological measurement. V3 correction: draft/report-only taxonomy patch; do not mutate seed without human approval.","CANDIDATE_AFTER_STRESS_REVIEW","ACCEPTED_HEURISTIC","Approved compressed stress profile HINGE_POSTERIOR_CHAIN_STRESS was applied with separate detail tags.","NONE","NONE","KEEP_DRAFT_ONLY_FOR_FINAL_SEED_APPROVAL","READY_AFTER_STRESS_REVIEW","STRESS_REVIEW_REQUIRED","","DEADLIFT_HINGE_VARIANTS","DUMBBELL_ROMANIAN_DEADLIFT","POSTERIOR_CHAIN_ACCESSORY","DUMBBELL_RDL_HINGE_ACCESSORY","VOLUME_LOAD","","FATIGUE|STRENGTH_PROGRESS|HYPERTROPHY_VOLUME|BALANCE","HINGE_POSTERIOR_CHAIN_STRESS","HAMSTRING_LOAD/GLUTE_LOAD/GRIP_LOAD/CORE_BRACING_LOAD/HEAVY_LOAD","HAMSTRING_TENDON_STRESS/FOREARM_FLEXOR_TENDON_STRESS","HIP_ROTATIONAL_CONTROL_STRESS/LUMBOPELVIC_CONTROL_STRESS","NONE","NONE","NONE","LONG","HIGH","","","","","","STRESS","READY_AFTER_DECISION_PACK","Approved compressed stress profile HINGE_POSTERIOR_CHAIN_STRESS was applied with separate detail tags.","","","","","","","",""
"덤벨 리스트 익스텐션","ex_72f11dc5","category=근력운동; movement_category=ACCESSORY; force_type=ISOLATION; movement_pattern=WRIST_FOREARM|FOREARM_ACCESSORY|GRIP_SUPPORT","WRIST_FOREARM|FOREARM_ACCESSORY|GRIP_SUPPORT","ACCESSORY","ISOLATION","EXERCISE","NOT_PRESENT_IN_SEED","FOREARM_GRIP_ACCESSORY_REVIEW","WRIST_EXTENSION","FOREARM_FLEXORS|FOREARM_EXTENSORS|PRONATOR_SUPINATOR_GROUP|GRIP_FLEXORS|WRIST_STABILIZERS","REVIEW","FOREARM_GRIP_ACCESSORY_REVIEW","FOREARM_WRIST_GRIP","QUALITY_BASED","LOCAL_MUSCLE|GRIP_FOREARM|WRIST_FOREARM_REVIEW|LOW_SYSTEMIC","NONE","GRIP_FOREARM_SUPPORT","FATIGUE|HYPERTROPHY_VOLUME|BADMINTON_TRANSFER|BALANCE","A_OPENSTAX_11_5|E_BADMINTON_INJURY_PMC7205924","anatomy_textbook","LOW","NO","NO","NO","NO","NO","NO","NO","NO","NO","NEEDS_TEMPLATE_DEFINITION","Forearm/grip rows are separated from arm isolation; subtype contribution remains under review.","DEFINE_AND_REVIEW_FAMILY_TEMPLATE","V2 taxonomy correction draft only. Muscle contribution is an app-internal heuristic, not a physiological measurement. Do not mutate seed without human approval.","NO","ANATOMY_SUPPORTED_TEMPLATE","Approved reusable template FOREARM_GRIP_ACCESSORY was applied. Source verification remains separate and unresolved.","NONE","SOURCE_ONLY","ACCEPT_SOURCE_POLICY_DRAFT_ONLY","READY_AFTER_SOURCE_VERIFICATION","TEMPLATE_DEFINITION_REQUIRED","FOREARM_GRIP_ACCESSORY","FOREARM_GRIP_ACCESSORY","WRIST_EXTENSION","FOREARM_GRIP_ACCESSORY","FOREARM_WRIST_GRIP_ACCESSORY","LOAD_REPS_OR_TIME","FOREARM_WRIST_GRIP_ACCESSORY","ACCESSORY_VOLUME/FATIGUE","","","","","","","","","","","","","","","TEMPLATE","SOURCE_ACCEPTED_DRAFT_ONLY","Approved reusable template FOREARM_GRIP_ACCESSORY was applied.","ANATOMY_SUPPORTED","ACCEPT_ANATOMY_SUPPORTED","The movement family, primary muscles, and program role are anatomically stable and conventional.","The badminton injury source is contextual only; anatomy support, not that injury source, carries the ordinary exercise classification.","NO","NONE","SOURCE_ACCEPTED","SOURCE_VERIFICATION_ONLY"
